ffff890e4d70ae40 3990529094 S Co:1:006:0 s 40 9a 1312 b282 0000 0
ffff890e4d70ae40 3990529334 C Co:1:006:0 0 0
ffff890e4d70ae40 3990529341 S Co:1:006:0 s 40 9a 2518 00c3 0000 0
ffff890e4d70ae40 3990529453 C Co:1:006:0 0 0
ffff890e4d70ae40 3990529457 S Co:1:006:0 s 40 a4 ffff 0000 0000 0
ffff890e4d70ae40 3990529578 C Co:1:006:0 0 0
ffff890ecbe43180 3990529582 S Ii:1:006:1 -115:1 8 <
ffff890e4d70ae40 3990529589 S Ci:1:006:0 s c0 95 0706 0000 0002 2 <
ffff890e4d70ae40 3990529703 C Ci:1:006:0 0 2 = ffee
ffff890e2aadc480 3990529707 S Bi:1:006:2 -115 32 <
ffff890d2c1f6d80 3990529709 S Bi:1:006:2 -115 32 <
ffff890e4d70ae40 3990529710 S Co:1:006:0 s 40 a4 ff9f 0000 0000 0
ffff890e2aadc480 3990529828 C Bi:1:006:2 0 2 = 3161
ffff890e2aadc480 3990529833 S Bi:1:006:2 -115 32 <
ffff890e4d70ae40 3990529834 C Co:1:006:0 0 0
ffff890e7cffd3c0 3990529852 S Bo:1:006:2 -115 1 = 31
ffff890e7cf9fcc0 3990529855 S Bo:1:006:2 -115 1 = 61
ffff890ea2e78a80 3990529871 S Co:1:006:0 s 40 9a 1312 cc83 0000 0
ffff890e7cffd3c0 3990529961 C Bo:1:006:2 0 1 >
ffff890e7cf9fcc0 3990529965 C Bo:1:006:2 0 1 >
ffff890d2c1f6d80 3990529965 C Bi:1:006:2 0 32 = 30613063 31613061 31633161 30613263 31613061 33633161 30613463 31613061
ffff890d2c1f6d80 3990529968 S Bi:1:006:2 -115 32 <
ffff890ea2e78a80 3990530077 C Co:1:006:0 0 0
ffff890ea2e78a80 3990530095 S Co:1:006:0 s 40 9a 2518 00c3 0000 0
ffff890ecbe43180 3990530318 C Ii:1:006:1 0:1 4 = 46bfffee
ffff890ecbe43180 3990530320 S Ii:1:006:1 -115:1 8 <
ffff890ea2e78a80 3990530322 C Co:1:006:0 0 0
ffff890ea2e78a80 3990530326 S Co:1:006:0 s 40 a4 ff9f 0000 0000 0
ffff890ea2e78a80 3990530442 C Co:1:006:0 0 0
ffff890ea2e78a80 3990530458 S Co:1:006:0 s 40 a4 ffff 0000 0000 0
ffff890ea2e78a80 3990530567 C Co:1:006:0 0 0
ffff890ecbe43180 3990531441 C Ii:1:006:1 0:1 4 = 023f9fee
ffff890ecbe43180 3990531443 S Ii:1:006:1 -115:1 8 <
ffff890ea2e78a80 3990780784 S Co:1:006:0 s 40 a4 ff9f 0000 0000 0
ffff890ea2e78a80 3990780987 C Co:1:006:0 0 0
ffff890e7cffd3c0 3991081748 S Bo:1:006:2 -115 2 = 3020
ffff890e7cffd3c0 3991081977 C Bo:1:006:2 0 2 >
ffff890e2aadc480 3991225440 C Bi:1:006:2 0 2 = 1410
ffff890e2aadc480 3991225481 S Bi:1:006:2 -115 32 <
ffff890e7cffd3c0 3991332129 S Bo:1:006:2 -115 2 = 3020
ffff890e7cffd3c0 3991332342 C Bo:1:006:2 0 2 >
ffff890d2c1f6d80 3991334709 C Bi:1:006:2 0 2 = 1410
ffff890d2c1f6d80 3991334751 S Bi:1:006:2 -115 32 <
ffff890e7cffd3c0 3991582508 S Bo:1:006:2 -115 2 = 3020
ffff890e7cffd3c0 3991582720 C Bo:1:006:2 0 2 >
ffff890e2aadc480 3991584876 C Bi:1:006:2 0 2 = 1410
ffff890e2aadc480 3991584906 S Bi:1:006:2 -115 32 <
ffff890e7cffd3c0 3991585084 S Bo:1:006:2 -115 3 = 418120
ffff890e7cffd3c0 3991585380 C Bo:1:006:2 0 3 >
ffff890d2c1f6d80 3991587622 C Bi:1:006:2 0 3 = 140410
ffff890d2c1f6d80 3991587644 S Bi:1:006:2 -115 32 <
ffff890e7cffd3c0 3991587777 S Bo:1:006:2 -115 3 = 418220
ffff890e7cffd3c0 3991587955 C Bo:1:006:2 0 3 >
ffff890e2aadc480 3991590457 C Bi:1:006:2 0 3 = 140410
ffff890e2aadc480 3991590496 S Bi:1:006:2 -115 32 <
ffff890e7cffd3c0 3991590687 S Bo:1:006:2 -115 22 = 42860000 01010101 03ffffff ff008004 00000080 0020
ffff890e7cffd3c0 3991590833 C Bo:1:006:2 0 22 >
ffff890d2c1f6d80 3991594796 C Bi:1:006:2 0 2 = 1410
ffff890d2c1f6d80 3991594832 S Bi:1:006:2 -115 32 <
ffff890e7cffd3c0 3991595004 S Bo:1:006:2 -115 7 = 450504d7 c20020
ffff890e7cffd3c0 3991595215 C Bo:1:006:2 0 7 >
ffff890e2aadc480 3991597880 C Bi:1:006:2 0 2 = 1410
ffff890e2aadc480 3991597910 S Bi:1:006:2 -115 32 <
ffff890e7cffd3c0 3991598063 S Bo:1:006:2 -115 2 = 5020
ffff890e7cffd3c0 3991598407 C Bo:1:006:2 0 2 >
ffff890d2c1f6d80 3991600625 C Bi:1:006:2 0 2 = 1410
ffff890d2c1f6d80 3991600645 S Bi:1:006:2 -115 32 <
ffff890e7cffd3c0 3991610931 S Bo:1:006:2 -115 2 = 7520
ffff890e7cffd3c0 3991611098 C Bo:1:006:2 0 2 >
ffff890e2aadc480 3991613584 C Bi:1:006:2 0 5 = 141e950f 10
ffff890e2aadc480 3991613624 S Bi:1:006:2 -115 32 <
ffff890e7cffd3c0 3991614208 S Bo:1:006:2 -115 4 = 55000020
ffff890e7cffd3c0 3991614332 C Bo:1:006:2 0 4 >
ffff890d2c1f6d80 3991617045 C Bi:1:006:2 0 2 = 1410
ffff890d2c1f6d80 3991617084 S Bi:1:006:2 -115 32 <
ffff890e7cffd3c0 3991617250 S Bo:1:006:2 -115 32 = 64008046 0c945c00 0c946e00 0c946e00 0c946e00 0c946e00 0c946e00 0c946e00
ffff890e7cf9fcc0 3991617271 S Bo:1:006:2 -115 32 = 0c946e00 0c946e00 0c946e00 0c946e00 0c946e00 0c946e00 0c946e00 0c946e00
ffff890e7cffd3c0 3991617453 C Bo:1:006:2 0 32 >
ffff890e7cffd3c0 3991617462 S Bo:1:006:2 -115 32 = 0c946e00 0c941401 0c946e00 0c946e00 0c946e00 0c946e00 0c946e00 0c946e00
ffff890e7cf9fcc0 3991617474 C Bo:1:006:2 0 32 >
ffff890e7cf9fcc0 3991617477 S Bo:1:006:2 -115 32 = 0c946e00 0c946e00 0c946e00 00000000 24002700 2a000000 00002500 28002b00
ffff890e7cffd3c0 3991620384 C Bo:1:006:2 0 32 >
ffff890e7cffd3c0 3991620410 S Bo:1:006:2 -115 5 = 04040404 20
ffff890e7cf9fcc0 3991623165 C Bo:1:006:2 0 32 >
ffff890e7cffd3c0 3991625931 C Bo:1:006:2 0 5 >
ffff890e2aadc480 3991631084 C Bi:1:006:2 0 1 = 14
ffff890e2aadc480 3991631122 S Bi:1:006:2 -115 32 <
ffff890d2c1f6d80 3991635424 C Bi:1:006:2 0 1 = 10
ffff890d2c1f6d80 3991635462 S Bi:1:006:2 -115 32 <
ffff890e7cffd3c0 3991635623 S Bo:1:006:2 -115 4 = 55400020
ffff890e7cffd3c0 3991635884 C Bo:1:006:2 0 4 >
ffff890e2aadc480 3991638127 C Bi:1:006:2 0 2 = 1410
ffff890e2aadc480 3991638148 S Bi:1:006:2 -115 32 <
ffff890e7cffd3c0 3991638279 S Bo:1:006:2 -115 32 = 64008046 04040404 02020202 02020303 03030303 01020408 10204080 01020408
ffff890e7cf9fcc0 3991638296 S Bo:1:006:2 -115 32 = 10200102 04081020 00000008 00020100 00030407 00000000 00000000 11241fbe
ffff890e7cffd3c0 3991638456 C Bo:1:006:2 0 32 >
ffff890e7cffd3c0 3991638463 S Bo:1:006:2 -115 32 = cfefd8e0 debfcdbf 21e0a0e0 b1e001c0 1d92a930 b207e1f7 0e945e01 0c94d701
ffff890e7cf9fcc0 3991638481 C Bo:1:006:2 0 32 >
ffff890e7cf9fcc0 3991638485 S Bo:1:006:2 -115 32 = 0c940000 90e0fc01 ec55ff4f 2491fc01 e057ff4f 3491fc01 e458ff4f e491ee23
ffff890e7cffd3c0 3991641422 C Bo:1:006:2 0 32 >
ffff890e7cffd3c0 3991641452 S Bo:1:006:2 -115 5 = c9f02223 20
ffff890e7cf9fcc0 3991644174 C Bo:1:006:2 0 32 >
ffff890e7cffd3c0 3991646966 C Bo:1:006:2 0 5 >
ffff890d2c1f6d80 3991652177 C Bi:1:006:2 0 1 = 14
ffff890d2c1f6d80 3991652216 S Bi:1:006:2 -115 32 <
ffff890e2aadc480 3991656552 C Bi:1:006:2 0 1 = 10
ffff890e2aadc480 3991656591 S Bi:1:006:2 -115 32 <
ffff890e7cffd3c0 3991656757 S Bo:1:006:2 -115 4 = 55800020
ffff890e7cffd3c0 3991657008 C Bo:1:006:2 0 4 >
ffff890d2c1f6d80 3991659372 C Bi:1:006:2 0 2 = 1410
ffff890d2c1f6d80 3991659395 S Bi:1:006:2 -115 32 <
ffff890e7cffd3c0 3991659523 S Bo:1:006:2 -115 32 = 64008046 39f02330 01f1a8f4 213019f1 223029f1 f0e0ee0f ff1fee58 ff4fa591
ffff890e7cf9fcc0 3991659539 S Bo:1:006:2 -115 32 = b4918fb7 f894ec91 611126c0 30953e23 3c938fbf 08952730 a9f02830 c9f02430
ffff890e7cffd3c0 3991659706 C Bo:1:006:2 0 32 >
ffff890e7cffd3c0 3991659712 S Bo:1:006:2 -115 32 = 49f78091 80008f7d 03c08091 80008f77 80938000 dfcf84b5 8f7784bd dbcf84b5
ffff890e7cf9fcc0 3991659731 C Bo:1:006:2 0 32 >
ffff890e7cf9fcc0 3991659734 S Bo:1:006:2 -115 32 = 8f7dfbcf 8091b000 8f778093 b000d2cf 8091b000 8f7df9cf 3e2bdacf 3fb7f894
ffff890e7cffd3c0 3991662713 C Bo:1:006:2 0 32 >
ffff890e7cffd3c0 3991662742 S Bo:1:006:2 -115 5 = 80910501 20
ffff890e7cf9fcc0 3991665457 C Bo:1:006:2 0 32 >
ffff890e7cffd3c0 3991668184 C Bo:1:006:2 0 5 >
ffff890e2aadc480 3991673425 C Bi:1:006:2 0 1 = 14
ffff890e2aadc480 3991673464 S Bi:1:006:2 -115 32 <
ffff890d2c1f6d80 3991677799 C Bi:1:006:2 0 1 = 10
ffff890d2c1f6d80 3991677838 S Bi:1:006:2 -115 32 <
ffff890e7cffd3c0 3991678004 S Bo:1:006:2 -115 4 = 55c00020
ffff890e7cffd3c0 3991678207 C Bo:1:006:2 0 4 >
ffff890e2aadc480 3991680837 C Bi:1:006:2 0 2 = 1410
ffff890e2aadc480 3991680872 S Bi:1:006:2 -115 32 <
ffff890e7cffd3c0 3991681008 S Bo:1:006:2 -115 32 = 64008046 90910601 a0910701 b0910801 26b5a89b 05c02f3f 19f00196 a11db11d
ffff890e7cf9fcc0 3991681029 S Bo:1:006:2 -115 32 = 3fbfba2f a92f982f 8827bc01 cd01620f 711d811d 911d42e0 660f771f 881f991f
ffff890e7cffd3c0 3991681238 C Bo:1:006:2 0 32 >
ffff890e7cffd3c0 3991681250 S Bo:1:006:2 -115 32 = 4a95d1f7 08958f92 9f92af92 bf92cf92 df92ef92 ff926b01 7c010e94 bc004b01
ffff890e7cf9fcc0 3991681263 C Bo:1:006:2 0 32 >
ffff890e7cf9fcc0 3991681265 S Bo:1:006:2 -115 32 = 5c01c114 d104e104 f104b9f0 0e94bc00 68197909 8a099b09 683e7340 81059105
ffff890e7cffd3c0 3991684211 C Bo:1:006:2 0 32 >
ffff890e7cffd3c0 3991684235 S Bo:1:006:2 -115 5 = 80f321e0 20
ffff890e7cf9fcc0 3991686874 C Bo:1:006:2 0 32 >
ffff890e7cffd3c0 3991689681 C Bo:1:006:2 0 5 >
ffff890d2c1f6d80 3991694761 C Bi:1:006:2 0 1 = 14
ffff890d2c1f6d80 3991694795 S Bi:1:006:2 -115 32 <
ffff890e2aadc480 3991699259 C Bi:1:006:2 0 1 = 10
ffff890e2aadc480 3991699288 S Bi:1:006:2 -115 32 <
ffff890e7cffd3c0 3991699390 S Bo:1:006:2 -115 4 = 55000120
ffff890e7cffd3c0 3991699616 C Bo:1:006:2 0 4 >
ffff890d2c1f6d80 3991702089 C Bi:1:006:2 0 2 = 1410
ffff890d2c1f6d80 3991702125 S Bi:1:006:2 -115 32 <
ffff890e7cffd3c0 3991702254 S Bo:1:006:2 -115 32 = 64008046 c21ad108 e108f108 88ee880e 83e0981e a11cb11c e4cfff90 ef90df90
ffff890e7cf9fcc0 3991702262 S Bo:1:006:2 -115 32 = cf90bf90 af909f90 8f900895 1f920f92 0fb60f92 11242f93 3f938f93 9f93af93
ffff890e7cffd3c0 3991702501 C Bo:1:006:2 0 32 >
ffff890e7cffd3c0 3991702515 S Bo:1:006:2 -115 32 = bf938091 01019091 0201a091 0301b091 04013091 000123e0 230f2d37 58f50196
ffff890e7cf9fcc0 3991702527 C Bo:1:006:2 0 32 >
ffff890e7cf9fcc0 3991702529 S Bo:1:006:2 -115 32 = a11db11d 20930001 80930101 90930201 a0930301 b0930401 80910501 90910601
ffff890e7cffd3c0 3991705420 C Bo:1:006:2 0 32 >
ffff890e7cffd3c0 3991705447 S Bo:1:006:2 -115 5 = a0910701 20
ffff890e7cf9fcc0 3991708014 C Bo:1:006:2 0 32 >
ffff890e7cffd3c0 3991710806 C Bo:1:006:2 0 5 >
ffff890e2aadc480 3991716005 C Bi:1:006:2 0 1 = 14
ffff890e2aadc480 3991716044 S Bi:1:006:2 -115 32 <
ffff890d2c1f6d80 3991720424 C Bi:1:006:2 0 1 = 10
ffff890d2c1f6d80 3991720460 S Bi:1:006:2 -115 32 <
ffff890e7cffd3c0 3991720613 S Bo:1:006:2 -115 4 = 55400120
ffff890e7cffd3c0 3991720899 C Bo:1:006:2 0 4 >
ffff890e2aadc480 3991723121 C Bi:1:006:2 0 2 = 1410
ffff890e2aadc480 3991723141 S Bi:1:006:2 -115 32 <
ffff890e7cffd3c0 3991723268 S Bo:1:006:2 -115 32 = 64008046 b0910801 0196a11d b11d8093 05019093 0601a093 0701b093 0801bf91
ffff890e7cf9fcc0 3991723285 S Bo:1:006:2 -115 32 = af919f91 8f913f91 2f910f90 0fbe0f90 1f901895 26e8230f 0296a11d b11dd2cf
ffff890e7cffd3c0 3991723447 C Bo:1:006:2 0 32 >
ffff890e7cffd3c0 3991723452 S Bo:1:006:2 -115 32 = 789484b5 826084bd 84b58160 84bd85b5 826085bd 85b58160 85bd8091 6e008160
ffff890e7cf9fcc0 3991723467 C Bo:1:006:2 0 32 >
ffff890e7cf9fcc0 3991723469 S Bo:1:006:2 -115 32 = 80936e00 10928100 80918100 82608093 81008091 81008160 80938100 80918000
ffff890e7cffd3c0 3991726459 C Bo:1:006:2 0 32 >
ffff890e7cffd3c0 3991726486 S Bo:1:006:2 -115 5 = 81608093 20
ffff890e7cf9fcc0 3991729131 C Bo:1:006:2 0 32 >
ffff890e7cffd3c0 3991731925 C Bo:1:006:2 0 5 >
ffff890d2c1f6d80 3991737173 C Bi:1:006:2 0 1 = 14
ffff890d2c1f6d80 3991737212 S Bi:1:006:2 -115 32 <
ffff890e2aadc480 3991741261 C Bi:1:006:2 0 1 = 10
ffff890e2aadc480 3991741295 S Bi:1:006:2 -115 32 <
ffff890e7cffd3c0 3991741448 S Bo:1:006:2 -115 4 = 55800120
ffff890e7cffd3c0 3991741626 C Bo:1:006:2 0 4 >
ffff890d2c1f6d80 3991744045 C Bi:1:006:2 0 2 = 1410
ffff890d2c1f6d80 3991744083 S Bi:1:006:2 -115 32 <
ffff890e7cffd3c0 3991744258 S Bo:1:006:2 -115 32 = 64008046 80008091 b1008460 8093b100 8091b000 81608093 b0008091 7a008460
ffff890e7cf9fcc0 3991744278 S Bo:1:006:2 -115 32 = 80937a00 80917a00 82608093 7a008091 7a008160 80937a00 80917a00 80688093
ffff890e7cffd3c0 3991744455 C Bo:1:006:2 0 32 >
ffff890e7cffd3c0 3991744465 S Bo:1:006:2 -115 32 = 7a001092 c100ede9 f0e02491 e9e8f0e0 84918823 99f090e0 880f991f fc01e859
ffff890e7cf9fcc0 3991744474 C Bo:1:006:2 0 32 >
ffff890e7cf9fcc0 3991744476 S Bo:1:006:2 -115 32 = ff4fa591 b491fc01 ee58ff4f 85919491 8fb7f894 ec91e22b ec938fbf c0e0d0e0
ffff890e7cffd3c0 3991747418 C Bo:1:006:2 0 32 >
ffff890e7cffd3c0 3991747448 S Bo:1:006:2 -115 5 = 61e08de0 20
ffff890e7cf9fcc0 3991750205 C Bo:1:006:2 0 32 >
ffff890e7cffd3c0 3991752970 C Bo:1:006:2 0 5 >
ffff890e2aadc480 3991758087 C Bi:1:006:2 0 1 = 14
ffff890e2aadc480 3991758125 S Bi:1:006:2 -115 32 <
ffff890d2c1f6d80 3991762456 C Bi:1:006:2 0 1 = 10
ffff890d2c1f6d80 3991762494 S Bi:1:006:2 -115 32 <
ffff890e7cffd3c0 3991762649 S Bo:1:006:2 -115 4 = 55c00120
ffff890e7cffd3c0 3991762876 C Bo:1:006:2 0 4 >
ffff890e2aadc480 3991765215 C Bi:1:006:2 0 2 = 1410
ffff890e2aadc480 3991765251 S Bi:1:006:2 -115 32 <
ffff890e7cffd3c0 3991765419 S Bo:1:006:2 -115 32 = 64008046 0e947000 68ee73e0 80e090e0 0e94e100 60e08de0 0e947000 68ee73e0
ffff890e7cf9fcc0 3991765439 S Bo:1:006:2 -115 32 = 80e090e0 0e94e100 209751f3 0e940000 e7cff894 ffcfffff ffffffff ffffffff
ffff890e7cffd3c0 3991765586 C Bo:1:006:2 0 32 >
ffff890e7cffd3c0 3991765595 S Bo:1:006:2 -115 32 = ffffffff ffffffff ffffffff ffffffff ffffffff ffffffff ffffffff ffffffff
ffff890e7cf9fcc0 3991765605 C Bo:1:006:2 0 32 >
ffff890e7cf9fcc0 3991765606 S Bo:1:006:2 -115 32 = ffffffff ffffffff ffffffff ffffffff ffffffff ffffffff ffffffff ffffffff
ffff890e7cffd3c0 3991768549 C Bo:1:006:2 0 32 >
ffff890e7cffd3c0 3991768578 S Bo:1:006:2 -115 5 = ffffffff 20
ffff890e7cf9fcc0 3991771331 C Bo:1:006:2 0 32 >
ffff890e7cffd3c0 3991774093 C Bo:1:006:2 0 5 >
ffff890d2c1f6d80 3991779170 C Bi:1:006:2 0 1 = 14
ffff890d2c1f6d80 3991779210 S Bi:1:006:2 -115 32 <
ffff890e2aadc480 3991783494 C Bi:1:006:2 0 1 = 10
ffff890e2aadc480 3991783515 S Bi:1:006:2 -115 32 <
ffff890e7cffd3c0 3991784271 S Bo:1:006:2 -115 4 = 55000020
ffff890e7cffd3c0 3991784449 C Bo:1:006:2 0 4 >
ffff890d2c1f6d80 3991787010 C Bi:1:006:2 0 2 = 1410
ffff890d2c1f6d80 3991787036 S Bi:1:006:2 -115 32 <
ffff890e7cffd3c0 3991787175 S Bo:1:006:2 -115 5 = 74008046 20
ffff890e7cffd3c0 3991787360 C Bo:1:006:2 0 5 >
ffff890e2aadc480 3991790626 C Bi:1:006:2 0 32 = 140c945c 000c946e 000c946e 000c946e 000c946e 000c946e 000c946e 000c946e
ffff890e2aadc480 3991790652 S Bi:1:006:2 -115 32 <
ffff890d2c1f6d80 3991793374 C Bi:1:006:2 0 32 = 000c946e 000c946e 000c946e 000c946e 000c946e 000c946e 000c946e 000c946e
ffff890d2c1f6d80 3991793394 S Bi:1:006:2 -115 32 <
ffff890e2aadc480 3991796046 C Bi:1:006:2 0 32 = 000c9414 010c946e 000c946e 000c946e 000c946e 000c946e 000c946e 000c946e
ffff890e2aadc480 3991796083 S Bi:1:006:2 -115 32 <
ffff890d2c1f6d80 3991798632 C Bi:1:006:2 0 32 = 000c946e 000c946e 00000000 00240027 002a0000 00000025 0028002b 00040404
ffff890d2c1f6d80 3991798709 S Bi:1:006:2 -115 32 <
ffff890e2aadc480 3991800631 C Bi:1:006:2 0 2 = 0410
ffff890e2aadc480 3991800661 S Bi:1:006:2 -115 32 <
ffff890e7cffd3c0 3991800814 S Bo:1:006:2 -115 4 = 55400020
ffff890e7cffd3c0 3991800998 C Bo:1:006:2 0 4 >
ffff890d2c1f6d80 3991803421 C Bi:1:006:2 0 2 = 1410
ffff890d2c1f6d80 3991803457 S Bi:1:006:2 -115 32 <
ffff890e7cffd3c0 3991803600 S Bo:1:006:2 -115 5 = 74008046 20
ffff890e7cffd3c0 3991803893 C Bo:1:006:2 0 5 >
ffff890e2aadc480 3991807097 C Bi:1:006:2 0 32 = 14040404 04020202 02020203 03030303 03010204 08102040 80010204 08102001
ffff890e2aadc480 3991807133 S Bi:1:006:2 -115 32 <
ffff890d2c1f6d80 3991809833 C Bi:1:006:2 0 32 = 02040810 20000000 08000201 00000304 07000000 00000000 0011241f becfefd8
ffff890d2c1f6d80 3991809868 S Bi:1:006:2 -115 32 <
ffff890e2aadc480 3991812586 C Bi:1:006:2 0 32 = e0debfcd bf21e0a0 e0b1e001 c01d92a9 30b207e1 f70e945e 010c94d7 010c9400
ffff890e2aadc480 3991812624 S Bi:1:006:2 -115 32 <
ffff890d2c1f6d80 3991815130 C Bi:1:006:2 0 32 = 0090e0fc 01ec55ff 4f2491fc 01e057ff 4f3491fc 01e458ff 4fe491ee 23c9f022
ffff890d2c1f6d80 3991815165 S Bi:1:006:2 -115 32 <
ffff890e2aadc480 3991817426 C Bi:1:006:2 0 2 = 2310
ffff890e2aadc480 3991817461 S Bi:1:006:2 -115 32 <
ffff890e7cffd3c0 3991817596 S Bo:1:006:2 -115 4 = 55800020
ffff890e7cffd3c0 3991817749 C Bo:1:006:2 0 4 >
ffff890d2c1f6d80 3991820211 C Bi:1:006:2 0 2 = 1410
ffff890d2c1f6d80 3991820246 S Bi:1:006:2 -115 32 <
ffff890e7cffd3c0 3991820378 S Bo:1:006:2 -115 5 = 74008046 20
ffff890e7cffd3c0 3991820622 C Bo:1:006:2 0 5 >
ffff890e2aadc480 3991823834 C Bi:1:006:2 0 32 = 1439f023 3001f1a8 f4213019 f1223029 f1f0e0ee 0fff1fee 58ff4fa5 91b4918f
ffff890e2aadc480 3991823871 S Bi:1:006:2 -115 32 <
ffff890d2c1f6d80 3991826499 C Bi:1:006:2 0 32 = b7f894ec 91611126 c030953e 233c938f bf089527 30a9f028 30c9f024 3049f780
ffff890d2c1f6d80 3991826518 S Bi:1:006:2 -115 32 <
ffff890e2aadc480 3991829331 C Bi:1:006:2 0 32 = 9180008f 7d03c080 9180008f 77809380 00dfcf84 b58f7784 bddbcf84 b58f7dfb
ffff890e2aadc480 3991829366 S Bi:1:006:2 -115 32 <
ffff890d2c1f6d80 3991831869 C Bi:1:006:2 0 32 = cf8091b0 008f7780 93b000d2 cf8091b0 008f7df9 cf3e2bda cf3fb7f8 94809105
ffff890d2c1f6d80 3991831905 S Bi:1:006:2 -115 32 <
ffff890e2aadc480 3991834170 C Bi:1:006:2 0 2 = 0110
ffff890e2aadc480 3991834207 S Bi:1:006:2 -115 32 <
ffff890e7cffd3c0 3991834336 S Bo:1:006:2 -115 4 = 55c00020
ffff890e7cffd3c0 3991834500 C Bo:1:006:2 0 4 >
ffff890d2c1f6d80 3991836837 C Bi:1:006:2 0 2 = 1410
ffff890d2c1f6d80 3991836872 S Bi:1:006:2 -115 32 <
ffff890e7cffd3c0 3991837005 S Bo:1:006:2 -115 5 = 74008046 20
ffff890e7cffd3c0 3991837252 C Bo:1:006:2 0 5 >
ffff890e2aadc480 3991840461 C Bi:1:006:2 0 32 = 14909106 01a09107 01b09108 0126b5a8 9b05c02f 3f19f001 96a11db1 1d3fbfba
ffff890e2aadc480 3991840497 S Bi:1:006:2 -115 32 <
ffff890d2c1f6d80 3991843167 C Bi:1:006:2 0 32 = 2fa92f98 2f8827bc 01cd0162 0f711d81 1d911d42 e0660f77 1f881f99 1f4a95d1
ffff890d2c1f6d80 3991843202 S Bi:1:006:2 -115 32 <
ffff890e2aadc480 3991845960 C Bi:1:006:2 0 32 = f708958f 929f92af 92bf92cf 92df92ef 92ff926b 017c010e 94bc004b 015c01c1
ffff890e2aadc480 3991845997 S Bi:1:006:2 -115 32 <
ffff890d2c1f6d80 3991848566 C Bi:1:006:2 0 32 = 14d104e1 04f104b9 f00e94bc 00681979 098a099b 09683e73 40810591 0580f321
ffff890d2c1f6d80 3991848602 S Bi:1:006:2 -115 32 <
ffff890e2aadc480 3991850546 C Bi:1:006:2 0 2 = e010
ffff890e2aadc480 3991850581 S Bi:1:006:2 -115 32 <
ffff890e7cffd3c0 3991850708 S Bo:1:006:2 -115 4 = 55000120
ffff890e7cffd3c0 3991850875 C Bo:1:006:2 0 4 >
ffff890d2c1f6d80 3991853212 C Bi:1:006:2 0 2 = 1410
ffff890d2c1f6d80 3991853247 S Bi:1:006:2 -115 32 <
ffff890e7cffd3c0 3991853379 S Bo:1:006:2 -115 5 = 74008046 20
ffff890e7cffd3c0 3991853624 C Bo:1:006:2 0 5 >
ffff890e2aadc480 3991856834 C Bi:1:006:2 0 32 = 14c21ad1 08e108f1 0888ee88 0e83e098 1ea11cb1 1ce4cfff 90ef90df 90cf90bf
ffff890e2aadc480 3991856872 S Bi:1:006:2 -115 32 <
ffff890d2c1f6d80 3991859543 C Bi:1:006:2 0 32 = 90af909f 908f9008 951f920f 920fb60f 9211242f 933f938f 939f93af 93bf9380
ffff890d2c1f6d80 3991859579 S Bi:1:006:2 -115 32 <
ffff890e2aadc480 3991862335 C Bi:1:006:2 0 32 = 91010190 910201a0 910301b0 91040130 91000123 e0230f2d 3758f501 96a11db1
ffff890e2aadc480 3991862371 S Bi:1:006:2 -115 32 <
ffff890d2c1f6d80 3991864940 C Bi:1:006:2 0 32 = 1d209300 01809301 01909302 01a09303 01b09304 01809105 01909106 01a09107
ffff890d2c1f6d80 3991864976 S Bi:1:006:2 -115 32 <
ffff890e2aadc480 3991866920 C Bi:1:006:2 0 2 = 0110
ffff890e2aadc480 3991866954 S Bi:1:006:2 -115 32 <
ffff890e7cffd3c0 3991867083 S Bo:1:006:2 -115 4 = 55400120
ffff890e7cffd3c0 3991867415 C Bo:1:006:2 0 4 >
ffff890d2c1f6d80 3991869879 C Bi:1:006:2 0 2 = 1410
ffff890d2c1f6d80 3991869902 S Bi:1:006:2 -115 32 <
ffff890e7cffd3c0 3991870011 S Bo:1:006:2 -115 5 = 74008046 20
ffff890e7cffd3c0 3991870244 C Bo:1:006:2 0 5 >
ffff890e2aadc480 3991873458 C Bi:1:006:2 0 32 = 14b09108 010196a1 1db11d80 93050190 930601a0 930701b0 930801bf 91af919f
ffff890e2aadc480 3991873492 S Bi:1:006:2 -115 32 <
ffff890d2c1f6d80 3991876122 C Bi:1:006:2 0 32 = 918f913f 912f910f 900fbe0f 901f9018 9526e823 0f0296a1 1db11dd2 cf789484
ffff890d2c1f6d80 3991876145 S Bi:1:006:2 -115 32 <
ffff890e2aadc480 3991878893 C Bi:1:006:2 0 32 = b5826084 bd84b581 6084bd85 b5826085 bd85b581 6085bd80 916e0081 6080936e
ffff890e2aadc480 3991878930 S Bi:1:006:2 -115 32 <
ffff890d2c1f6d80 3991881641 C Bi:1:006:2 0 32 = 00109281 00809181 00826080 93810080 91810081 60809381 00809180 00816080
ffff890d2c1f6d80 3991881730 S Bi:1:006:2 -115 32 <
ffff890e2aadc480 3991883520 C Bi:1:006:2 0 2 = 9310
ffff890e2aadc480 3991883541 S Bi:1:006:2 -115 32 <
ffff890e7cffd3c0 3991883645 S Bo:1:006:2 -115 4 = 55800120
ffff890e7cffd3c0 3991883883 C Bo:1:006:2 0 4 >
ffff890d2c1f6d80 3991886373 C Bi:1:006:2 0 2 = 1410
ffff890d2c1f6d80 3991886391 S Bi:1:006:2 -115 32 <
ffff890e7cffd3c0 3991886491 S Bo:1:006:2 -115 5 = 74008046 20
ffff890e7cffd3c0 3991886748 C Bo:1:006:2 0 5 >
ffff890e2aadc480 3991889881 C Bi:1:006:2 0 32 = 14800080 91b10084 608093b1 008091b0 00816080 93b00080 917a0084 6080937a
ffff890e2aadc480 3991889912 S Bi:1:006:2 -115 32 <
ffff890d2c1f6d80 3991892626 C Bi:1:006:2 0 32 = 0080917a 00826080 937a0080 917a0081 6080937a 0080917a 00806880 937a0010
ffff890d2c1f6d80 3991892646 S Bi:1:006:2 -115 32 <
ffff890e2aadc480 3991895456 C Bi:1:006:2 0 32 = 92c100ed e9f0e024 91e9e8f0 e0849188 2399f090 e0880f99 1ffc01e8 59ff4fa5
ffff890e2aadc480 3991895492 S Bi:1:006:2 -115 32 <
ffff890d2c1f6d80 3991897991 C Bi:1:006:2 0 32 = 91b491fc 01ee58ff 4f859194 918fb7f8 94ec91e2 2bec938f bfc0e0d0 e061e08d
ffff890d2c1f6d80 3991898026 S Bi:1:006:2 -115 32 <
ffff890e2aadc480 3991900001 C Bi:1:006:2 0 2 = e010
ffff890e2aadc480 3991900020 S Bi:1:006:2 -115 32 <
ffff890e7cffd3c0 3991900128 S Bo:1:006:2 -115 4 = 55c00120
ffff890e7cffd3c0 3991900378 C Bo:1:006:2 0 4 >
ffff890d2c1f6d80 3991902636 C Bi:1:006:2 0 2 = 1410
ffff890d2c1f6d80 3991902654 S Bi:1:006:2 -115 32 <
ffff890e7cffd3c0 3991902754 S Bo:1:006:2 -115 5 = 74008046 20
ffff890e7cffd3c0 3991902997 C Bo:1:006:2 0 5 >
ffff890e2aadc480 3991906176 C Bi:1:006:2 0 32 = 140e9470 0068ee73 e080e090 e00e94e1 0060e08d e00e9470 0068ee73 e080e090
ffff890e2aadc480 3991906212 S Bi:1:006:2 -115 32 <
ffff890d2c1f6d80 3991908870 C Bi:1:006:2 0 32 = e00e94e1 00209751 f30e9400 00e7cff8 94ffcfff ffffffff ffffffff ffffffff
ffff890d2c1f6d80 3991908893 S Bi:1:006:2 -115 32 <
ffff890e2aadc480 3991911706 C Bi:1:006:2 0 32 = ffffffff ffffffff ffffffff ffffffff ffffffff ffffffff ffffffff ffffffff
ffff890e2aadc480 3991911742 S Bi:1:006:2 -115 32 <
ffff890d2c1f6d80 3991914486 C Bi:1:006:2 0 32 = ffffffff ffffffff ffffffff ffffffff ffffffff ffffffff ffffffff ffffffff
ffff890d2c1f6d80 3991914522 S Bi:1:006:2 -115 32 <
ffff890e2aadc480 3991916420 C Bi:1:006:2 0 2 = ff10
ffff890e2aadc480 3991916456 S Bi:1:006:2 -115 32 <
ffff890e7cffd3c0 3991916813 S Bo:1:006:2 -115 2 = 5120
ffff890e7cffd3c0 3991917000 C Bo:1:006:2 0 2 >
ffff890d2c1f6d80 3991919455 C Bi:1:006:2 0 2 = 1410
ffff890d2c1f6d80 3991919491 S Bi:1:006:2 -115 32 <
ffff890dea417cc0 3991919621 S Co:1:006:0 s 40 a4 ffff 0000 0000 0
ffff890dea417cc0 3991919871 C Co:1:006:0 0 0
ffff890dea417cc0 3991919970 S Co:1:006:0 s 40 9a 1312 b282 0000 0
ffff890dea417cc0 3991920240 C Co:1:006:0 0 0
ffff890dea417cc0 3991920316 S Co:1:006:0 s 40 9a 2518 00c3 0000 0
ffff890dea417cc0 3991920492 C Co:1:006:0 0 0
ffff890dea417cc0 3991920567 S Co:1:006:0 s 40 a4 ffff 0000 0000 0
ffff890dea417cc0 3991920742 C Co:1:006:0 0 0
ffff890dea417cc0 3991920858 S Co:1:006:0 s 40 a4 ffff 0000 0000 0
ffff890dea417cc0 3991921118 C Co:1:006:0 0 0
ffff890e2aadc480 3991924456 C Bi:1:006:2 -2 0
ffff890d2c1f6d80 3991924505 C Bi:1:006:2 -2 0
ffff890e4d70ae40 3991924595 S Co:1:002:0 s 23 08 9062 0001 0000 0
ffff890e4d70ae40 3991924875 C Co:1:002:0 0 0
ffff890ecbe43180 3991926784 C Ii:1:006:1 -2:1 0
