ffff890d2c1f6600 3228690542 S Co:1:006:0 s 40 9a 1312 b282 0000 0
ffff890d2c1f6600 3228690744 C Co:1:006:0 0 0
ffff890d2c1f6600 3228690755 S Co:1:006:0 s 40 9a 2518 00c3 0000 0
ffff890d2c1f6600 3228690966 C Co:1:006:0 0 0
ffff890d2c1f6600 3228690974 S Co:1:006:0 s 40 a4 ffff 0000 0000 0
ffff890d2c1f6600 3228691092 C Co:1:006:0 0 0
ffff890ecbe43180 3228691099 S Ii:1:006:1 -115:1 8 <
ffff890d2c1f6600 3228691109 S Ci:1:006:0 s c0 95 0706 0000 0002 2 <
ffff890d2c1f6600 3228691343 C Ci:1:006:0 0 2 = ffee
ffff890e2aadc480 3228691350 S Bi:1:006:2 -115 32 <
ffff890d2c1f6d80 3228691352 S Bi:1:006:2 -115 32 <
ffff890d2c1f6600 3228691354 S Co:1:006:0 s 40 a4 ff9f 0000 0000 0
ffff890e2aadc480 3228691465 C Bi:1:006:2 0 2 = 3161
ffff890e2aadc480 3228691473 S Bi:1:006:2 -115 32 <
ffff890d2c1f6600 3228691476 C Co:1:006:0 0 0
ffff890e7cffd3c0 3228691487 S Bo:1:006:2 -115 1 = 31
ffff890e7cf9fcc0 3228691490 S Bo:1:006:2 -115 1 = 61
ffff890e7cffd3c0 3228691591 C Bo:1:006:2 0 1 >
ffff890e7cf9fcc0 3228691597 C Bo:1:006:2 0 1 >
ffff890d2c1f6d80 3228691597 C Bi:1:006:2 0 32 = 30613063 31613061 31633161 30613263 31613061 33633161 30613463 31613061
ffff890d2c1f6600 3228691598 S Co:1:006:0 s 40 9a 1312 cc83 0000 0
ffff890d2c1f6d80 3228691601 S Bi:1:006:2 -115 32 <
ffff890d2c1f6600 3228691716 C Co:1:006:0 0 0
ffff890d2c1f6600 3228691763 S Co:1:006:0 s 40 9a 2518 00c3 0000 0
ffff890d2c1f6600 3228691969 C Co:1:006:0 0 0
ffff890def1606c0 3228691981 S Co:1:006:0 s 40 a4 ff9f 0000 0000 0
ffff890def1606c0 3228692104 C Co:1:006:0 0 0
ffff890d2c1f6600 3228692144 S Co:1:006:0 s 40 a4 ffff 0000 0000 0
ffff890ecbe43180 3228692343 C Ii:1:006:1 0:1 4 = 463fffee
ffff890ecbe43180 3228692345 S Ii:1:006:1 -115:1 8 <
ffff890d2c1f6600 3228692347 C Co:1:006:0 0 0
ffff890ecbe43180 3228693472 C Ii:1:006:1 0:1 4 = 02bf9fee
ffff890ecbe43180 3228693477 S Ii:1:006:1 -115:1 8 <
ffff890d2c1f60c0 3228942540 S Co:1:006:0 s 40 a4 ff9f 0000 0000 0
ffff890d2c1f60c0 3228942794 C Co:1:006:0 0 0
ffff890e7cffd3c0 3229243543 S Bo:1:006:2 -115 2 = 3020
ffff890e7cffd3c0 3229243781 C Bo:1:006:2 0 2 >
ffff890e2aadc480 3229386985 C Bi:1:006:2 0 2 = 1410
ffff890e2aadc480 3229387025 S Bi:1:006:2 -115 32 <
ffff890e7cffd3c0 3229493769 S Bo:1:006:2 -115 2 = 3020
ffff890e7cffd3c0 3229494026 C Bo:1:006:2 0 2 >
ffff890d2c1f6d80 3229496235 C Bi:1:006:2 0 2 = 1410
ffff890d2c1f6d80 3229496274 S Bi:1:006:2 -115 32 <
ffff890e7cffd3c0 3229744216 S Bo:1:006:2 -115 2 = 3020
ffff890e7cffd3c0 3229744363 C Bo:1:006:2 0 2 >
ffff890e2aadc480 3229746817 C Bi:1:006:2 0 2 = 1410
ffff890e2aadc480 3229746851 S Bi:1:006:2 -115 32 <
ffff890e7cffd3c0 3229746987 S Bo:1:006:2 -115 3 = 418120
ffff890e7cffd3c0 3229747105 C Bo:1:006:2 0 3 >
ffff890d2c1f6d80 3229749445 C Bi:1:006:2 0 3 = 140410
ffff890d2c1f6d80 3229749481 S Bi:1:006:2 -115 32 <
ffff890e7cffd3c0 3229749617 S Bo:1:006:2 -115 3 = 418220
ffff890e7cffd3c0 3229749738 C Bo:1:006:2 0 3 >
ffff890e2aadc480 3229752156 C Bi:1:006:2 0 3 = 140410
ffff890e2aadc480 3229752190 S Bi:1:006:2 -115 32 <
ffff890e7cffd3c0 3229752331 S Bo:1:006:2 -115 22 = 42860000 01010101 03ffffff ff008004 00000080 0020
ffff890e7cffd3c0 3229752510 C Bo:1:006:2 0 22 >
ffff890d2c1f6d80 3229756730 C Bi:1:006:2 0 2 = 1410
ffff890d2c1f6d80 3229756765 S Bi:1:006:2 -115 32 <
ffff890e7cffd3c0 3229756895 S Bo:1:006:2 -115 7 = 450504d7 c20020
ffff890e7cffd3c0 3229757148 C Bo:1:006:2 0 7 >
ffff890e2aadc480 3229759660 C Bi:1:006:2 0 2 = 1410
ffff890e2aadc480 3229759678 S Bi:1:006:2 -115 32 <
ffff890e7cffd3c0 3229759760 S Bo:1:006:2 -115 2 = 5020
ffff890e7cffd3c0 3229759848 C Bo:1:006:2 0 2 >
ffff890d2c1f6d80 3229762072 C Bi:1:006:2 0 2 = 1410
ffff890d2c1f6d80 3229762107 S Bi:1:006:2 -115 32 <
ffff890e7cffd3c0 3229772413 S Bo:1:006:2 -115 2 = 7520
ffff890e7cffd3c0 3229772654 C Bo:1:006:2 0 2 >
ffff890e2aadc480 3229775072 C Bi:1:006:2 0 5 = 141e950f 10
ffff890e2aadc480 3229775108 S Bi:1:006:2 -115 32 <
ffff890e7cffd3c0 3229775836 S Bo:1:006:2 -115 4 = 55000020
ffff890e7cffd3c0 3229775970 C Bo:1:006:2 0 4 >
ffff890d2c1f6d80 3229778603 C Bi:1:006:2 0 2 = 1410
ffff890d2c1f6d80 3229778638 S Bi:1:006:2 -115 32 <
ffff890e7cffd3c0 3229778758 S Bo:1:006:2 -115 32 = 64008046 0c945d00 0c948500 0c948500 0c948500 0c948500 0c948500 0c948500
ffff890e7cf9fcc0 3229778765 S Bo:1:006:2 -115 32 = 0c948500 0c948500 0c948500 0c948500 0c948500 0c948500 0c948500 0c948500
ffff890e7cffd3c0 3229779016 C Bo:1:006:2 0 32 >
ffff890e7cffd3c0 3229779030 S Bo:1:006:2 -115 32 = 0c948500 0c94b402 0c948500 0c942403 0c94fe02 0c948500 0c948500 0c948500
ffff890e7cf9fcc0 3229779042 C Bo:1:006:2 0 32 >
ffff890e7cf9fcc0 3229779044 S Bo:1:006:2 -115 32 = 0c948500 0c948500 0c948500 00000000 24002700 2a000000 00002500 28002b00
ffff890e7cffd3c0 3229781770 C Bo:1:006:2 0 32 >
ffff890e7cffd3c0 3229781784 S Bo:1:006:2 -115 5 = 04040404 20
ffff890e7cf9fcc0 3229784532 C Bo:1:006:2 0 32 >
ffff890e7cffd3c0 3229787451 C Bo:1:006:2 0 5 >
ffff890e2aadc480 3229792527 C Bi:1:006:2 0 1 = 14
ffff890e2aadc480 3229792556 S Bi:1:006:2 -115 32 <
ffff890d2c1f6d80 3229796899 C Bi:1:006:2 0 1 = 10
ffff890d2c1f6d80 3229796920 S Bi:1:006:2 -115 32 <
ffff890e7cffd3c0 3229797001 S Bo:1:006:2 -115 4 = 55400020
ffff890e7cffd3c0 3229797099 C Bo:1:006:2 0 4 >
ffff890e2aadc480 3229799691 C Bi:1:006:2 0 2 = 1410
ffff890e2aadc480 3229799727 S Bi:1:006:2 -115 32 <
ffff890e7cffd3c0 3229799858 S Bo:1:006:2 -115 32 = 64008046 04040404 02020202 02020303 03030303 01020408 10204080 01020408
ffff890e7cf9fcc0 3229799869 S Bo:1:006:2 -115 32 = 10200102 04081020 00000008 00020100 00030407 00000000 00000000 67041124
ffff890e7cffd3c0 3229799982 C Bo:1:006:2 0 32 >
ffff890e7cffd3c0 3229799991 S Bo:1:006:2 -115 32 = 1fbecfef d8e0debf cdbf11e0 a0e0b1e0 ece7f9e0 02c00590 0d92aa31 b107d9f7
ffff890e7cf9fcc0 3229800104 C Bo:1:006:2 0 32 >
ffff890e7cf9fcc0 3229800108 S Bo:1:006:2 -115 32 = 21e0aae1 b1e001c0 1d92a23c b207e1f7 10e0cde5 d0e004c0 2197fe01 0e94b604
ffff890e7cffd3c0 3229802941 C Bo:1:006:2 0 32 >
ffff890e7cffd3c0 3229802968 S Bo:1:006:2 -115 5 = cc35d107 20
ffff890e7cf9fcc0 3229805692 C Bo:1:006:2 0 32 >
ffff890e7cffd3c0 3229808492 C Bo:1:006:2 0 5 >
ffff890d2c1f6d80 3229813731 C Bi:1:006:2 0 1 = 14
ffff890d2c1f6d80 3229813765 S Bi:1:006:2 -115 32 <
ffff890e2aadc480 3229818016 C Bi:1:006:2 0 1 = 10
ffff890e2aadc480 3229818043 S Bi:1:006:2 -115 32 <
ffff890e7cffd3c0 3229818142 S Bo:1:006:2 -115 4 = 55800020
ffff890e7cffd3c0 3229818404 C Bo:1:006:2 0 4 >
ffff890d2c1f6d80 3229820769 C Bi:1:006:2 0 2 = 1410
ffff890d2c1f6d80 3229820790 S Bi:1:006:2 -115 32 <
ffff890e7cffd3c0 3229820873 S Bo:1:006:2 -115 32 = 64008046 c9f70e94 56030c94 bc040c94 000090e0 fc01ec55 ff4f2491 fc01e057
ffff890e7cf9fcc0 3229820879 S Bo:1:006:2 -115 32 = ff4f3491 fc01e458 ff4fe491 ee23c9f0 222339f0 233001f1 a8f42130 19f12230
ffff890e7cffd3c0 3229821146 C Bo:1:006:2 0 32 >
ffff890e7cffd3c0 3229821160 S Bo:1:006:2 -115 32 = 29f1f0e0 ee0fff1f ee58ff4f a591b491 8fb7f894 ec916111 26c03095 3e233c93
ffff890e7cf9fcc0 3229821171 C Bo:1:006:2 0 32 >
ffff890e7cf9fcc0 3229821173 S Bo:1:006:2 -115 32 = 8fbf0895 2730a9f0 2830c9f0 243049f7 80918000 8f7d03c0 80918000 8f778093
ffff890e7cffd3c0 3229823941 C Bo:1:006:2 0 32 >
ffff890e7cffd3c0 3229823968 S Bo:1:006:2 -115 5 = 8000dfcf 20
ffff890e7cf9fcc0 3229826644 C Bo:1:006:2 0 32 >
ffff890e7cffd3c0 3229829456 C Bo:1:006:2 0 5 >
ffff890e2aadc480 3229834487 C Bi:1:006:2 0 1 = 14
ffff890e2aadc480 3229834524 S Bi:1:006:2 -115 32 <
ffff890d2c1f6d80 3229838941 C Bi:1:006:2 0 1 = 10
ffff890d2c1f6d80 3229838975 S Bi:1:006:2 -115 32 <
ffff890e7cffd3c0 3229839099 S Bo:1:006:2 -115 4 = 55c00020
ffff890e7cffd3c0 3229839436 C Bo:1:006:2 0 4 >
ffff890e2aadc480 3229841649 C Bi:1:006:2 0 2 = 1410
ffff890e2aadc480 3229841668 S Bi:1:006:2 -115 32 <
ffff890e7cffd3c0 3229841751 S Bo:1:006:2 -115 32 = 64008046 84b58f77 84bddbcf 84b58f7d fbcf8091 b0008f77 8093b000 d2cf8091
ffff890e7cf9fcc0 3229841757 S Bo:1:006:2 -115 32 = b0008f7d f9cf3e2b dacf3fb7 f8948091 21019091 2201a091 2301b091 240126b5
ffff890e7cffd3c0 3229842014 C Bo:1:006:2 0 32 >
ffff890e7cffd3c0 3229842028 S Bo:1:006:2 -115 32 = a89b05c0 2f3f19f0 0196a11d b11d3fbf ba2fa92f 982f8827 bc01cd01 620f711d
ffff890e7cf9fcc0 3229842039 C Bo:1:006:2 0 32 >
ffff890e7cf9fcc0 3229842041 S Bo:1:006:2 -115 32 = 811d911d 42e0660f 771f881f 991f4a95 d1f70895 8f929f92 af92bf92 cf92df92
ffff890e7cffd3c0 3229844777 C Bo:1:006:2 0 32 >
ffff890e7cffd3c0 3229844801 S Bo:1:006:2 -115 5 = ef92ff92 20
ffff890e7cf9fcc0 3229847565 C Bo:1:006:2 0 32 >
ffff890e7cffd3c0 3229850495 C Bo:1:006:2 0 5 >
ffff890d2c1f6d80 3229855733 C Bi:1:006:2 0 1 = 14
ffff890d2c1f6d80 3229855770 S Bi:1:006:2 -115 32 <
ffff890e2aadc480 3229859676 C Bi:1:006:2 0 1 = 10
ffff890e2aadc480 3229859708 S Bi:1:006:2 -115 32 <
ffff890e7cffd3c0 3229859815 S Bo:1:006:2 -115 4 = 55000120
ffff890e7cffd3c0 3229860019 C Bo:1:006:2 0 4 >
ffff890d2c1f6d80 3229862479 C Bi:1:006:2 0 2 = 1410
ffff890d2c1f6d80 3229862514 S Bi:1:006:2 -115 32 <
ffff890e7cffd3c0 3229862652 S Bo:1:006:2 -115 32 = 64008046 6b017c01 0e94d300 4b015c01 c114d104 e104f104 b9f00e94 d3006819
ffff890e7cf9fcc0 3229862660 S Bo:1:006:2 -115 32 = 79098a09 9b09683e 73408105 910580f3 21e0c21a d108e108 f10888ee 880e83e0
ffff890e7cffd3c0 3229862898 C Bo:1:006:2 0 32 >
ffff890e7cffd3c0 3229862911 S Bo:1:006:2 -115 32 = 981ea11c b11ce4cf ff90ef90 df90cf90 bf90af90 9f908f90 0895af92 bf92cf92
ffff890e7cf9fcc0 3229862923 C Bo:1:006:2 0 32 >
ffff890e7cf9fcc0 3229862925 S Bo:1:006:2 -115 32 = df92ef92 ff920f93 1f93cf93 df936c01 7b018b01 040f151f eb015e01 ae18bf08
ffff890e7cffd3c0 3229865697 C Bo:1:006:2 0 32 >
ffff890e7cffd3c0 3229865725 S Bo:1:006:2 -115 5 = c017d107 20
ffff890e7cf9fcc0 3229868536 C Bo:1:006:2 0 32 >
ffff890e7cffd3c0 3229871239 C Bo:1:006:2 0 5 >
ffff890e2aadc480 3229876484 C Bi:1:006:2 0 1 = 14
ffff890e2aadc480 3229876520 S Bi:1:006:2 -115 32 <
ffff890d2c1f6d80 3229880948 C Bi:1:006:2 0 1 = 10
ffff890d2c1f6d80 3229880984 S Bi:1:006:2 -115 32 <
ffff890e7cffd3c0 3229881100 S Bo:1:006:2 -115 4 = 55400120
ffff890e7cffd3c0 3229881435 C Bo:1:006:2 0 4 >
ffff890e2aadc480 3229883896 C Bi:1:006:2 0 2 = 1410
ffff890e2aadc480 3229883920 S Bi:1:006:2 -115 32 <
ffff890e7cffd3c0 3229884118 S Bo:1:006:2 -115 32 = 64008046 59f06991 d601ed91 fc910190 f081e02d c6010995 892b79f7 c501df91
ffff890e7cf9fcc0 3229884127 S Bo:1:006:2 -115 32 = cf911f91 0f91ff90 ef90df90 cf90bf90 af900895 fc01538d 448d252f 30e0842f
ffff890e7cffd3c0 3229884399 C Bo:1:006:2 0 32 >
ffff890e7cffd3c0 3229884412 S Bo:1:006:2 -115 32 = 90e0821b 930b5417 10f0cf96 08950197 0895fc01 918d828d 981761f0 a28dae0f
ffff890e7cf9fcc0 3229884424 C Bo:1:006:2 0 32 >
ffff890e7cf9fcc0 3229884427 S Bo:1:006:2 -115 32 = bf2fb11d 5d968c91 928d9f5f 9f73928f 90e00895 8fef9fef 0895fc01 918d828d
ffff890e7cffd3c0 3229887193 C Bo:1:006:2 0 32 >
ffff890e7cffd3c0 3229887221 S Bo:1:006:2 -115 5 = 981731f0 20
ffff890e7cf9fcc0 3229890067 C Bo:1:006:2 0 32 >
ffff890e7cffd3c0 3229892829 C Bo:1:006:2 0 5 >
ffff890d2c1f6d80 3229897948 C Bi:1:006:2 0 1 = 14
ffff890d2c1f6d80 3229897982 S Bi:1:006:2 -115 32 <
ffff890e2aadc480 3229902479 C Bi:1:006:2 0 1 = 10
ffff890e2aadc480 3229902514 S Bi:1:006:2 -115 32 <
ffff890e7cffd3c0 3229902636 S Bo:1:006:2 -115 4 = 55800120
ffff890e7cffd3c0 3229902937 C Bo:1:006:2 0 4 >
ffff890d2c1f6d80 3229905149 C Bi:1:006:2 0 2 = 1410
ffff890d2c1f6d80 3229905167 S Bi:1:006:2 -115 32 <
ffff890e7cffd3c0 3229905251 S Bo:1:006:2 -115 32 = 64008046 828de80f f11d858d 90e00895 8fef9fef 0895fc01 918d228d 892f90e0
ffff890e7cf9fcc0 3229905257 S Bo:1:006:2 -115 32 = 805c9f4f 821b9109 8f739927 089585e2 91e00e94 890121e0 892b09f4 20e0822f
ffff890e7cffd3c0 3229905519 C Bo:1:006:2 0 32 >
ffff890e7cffd3c0 3229905531 S Bo:1:006:2 -115 32 = 089580e0 90e0892b 29f00e94 95018111 0c940000 0895fc01 a48da80f b92fb11d
ffff890e7cf9fcc0 3229905542 C Bo:1:006:2 0 32 >
ffff890e7cf9fcc0 3229905544 S Bo:1:006:2 -115 32 = a35abf4f 2c91848d 90e00196 8f739927 848fa689 b7892c93 a089b189 8c918370
ffff890e7cffd3c0 3229908320 C Bo:1:006:2 0 32 >
ffff890e7cffd3c0 3229908347 S Bo:1:006:2 -115 5 = 80648c93 20
ffff890e7cf9fcc0 3229911069 C Bo:1:006:2 0 32 >
ffff890e7cffd3c0 3229913828 C Bo:1:006:2 0 5 >
ffff890e2aadc480 3229919112 C Bi:1:006:2 0 1 = 14
ffff890e2aadc480 3229919150 S Bi:1:006:2 -115 32 <
ffff890d2c1f6d80 3229923163 C Bi:1:006:2 0 1 = 10
ffff890d2c1f6d80 3229923197 S Bi:1:006:2 -115 32 <
ffff890e7cffd3c0 3229923380 S Bo:1:006:2 -115 4 = 55c00120
ffff890e7cffd3c0 3229923689 C Bo:1:006:2 0 4 >
ffff890e2aadc480 3229925883 C Bi:1:006:2 0 2 = 1410
ffff890e2aadc480 3229925902 S Bi:1:006:2 -115 32 <
ffff890e7cffd3c0 3229925978 S Bo:1:006:2 -115 32 = 64008046 938d848d 981306c0 0288f389 e02d8081 8f7d8083 0895ef92 ff920f93
ffff890e7cf9fcc0 3229925982 S Bo:1:006:2 -115 32 = 1f93cf93 df93ec01 81e0888f 9b8d8c8d 98131ac0 e889f989 808185ff 15c09fb7
ffff890e7cffd3c0 3229926091 C Bo:1:006:2 0 32 >
ffff890e7cffd3c0 3229926098 S Bo:1:006:2 -115 32 = f894ee89 ff896083 e889f989 80818370 80648083 9fbf81e0 90e0df91 cf911f91
ffff890e7cf9fcc0 3229926267 C Bo:1:006:2 0 32 >
ffff890e7cf9fcc0 3229926279 S Bo:1:006:2 -115 32 = 0f91ff90 ef900895 f62e0b8d 10e00f5f 1f4f0f73 1127e02e 8c8d8e11 0cc00fb6
ffff890e7cffd3c0 3229929025 C Bo:1:006:2 0 32 >
ffff890e7cffd3c0 3229929049 S Bo:1:006:2 -115 5 = 07fcfacf 20
ffff890e7cf9fcc0 3229931769 C Bo:1:006:2 0 32 >
ffff890e7cffd3c0 3229934617 C Bo:1:006:2 0 5 >
ffff890d2c1f6d80 3229939733 C Bi:1:006:2 0 1 = 14
ffff890d2c1f6d80 3229939768 S Bi:1:006:2 -115 32 <
ffff890e2aadc480 3229944067 C Bi:1:006:2 0 1 = 10
ffff890e2aadc480 3229944102 S Bi:1:006:2 -115 32 <
ffff890e7cffd3c0 3229944229 S Bo:1:006:2 -115 4 = 55000220
ffff890e7cffd3c0 3229944356 C Bo:1:006:2 0 4 >
ffff890d2c1f6d80 3229946817 C Bi:1:006:2 0 2 = 1410
ffff890d2c1f6d80 3229946853 S Bi:1:006:2 -115 32 <
ffff890e7cffd3c0 3229946985 S Bo:1:006:2 -115 32 = 64008046 e889f989 808185ff f5cfce01 0e94a901 f1cfeb8d ec0ffd2f f11de35a
ffff890e7cf9fcc0 3229946991 S Bo:1:006:2 -115 32 = ff4ff082 9fb7f894 0b8fea89 fb898081 8062cfcf cf93df93 ec01888d 8823b9f0
ffff890e7cffd3c0 3229947105 C Bo:1:006:2 0 32 >
ffff890e7cffd3c0 3229947115 S Bo:1:006:2 -115 32 = aa89bb89 e889f989 8c9185fd 03c08081 86fd0dc0 0fb607fc f7cf8c91 85fff2cf
ffff890e7cf9fcc0 3229947215 C Bo:1:006:2 0 32 >
ffff890e7cf9fcc0 3229947220 S Bo:1:006:2 -115 32 = 808185ff edcfce01 0e94a901 e9cfdf91 cf910895 fc010190 0020e9f7 3197af01
ffff890e7cffd3c0 3229949963 C Bo:1:006:2 0 32 >
ffff890e7cffd3c0 3229949968 S Bo:1:006:2 -115 5 = 481b590b 20
ffff890e7cf9fcc0 3229952816 C Bo:1:006:2 0 32 >
ffff890e7cffd3c0 3229955613 C Bo:1:006:2 0 5 >
ffff890e2aadc480 3229960860 C Bi:1:006:2 0 1 = 14
ffff890e2aadc480 3229960896 S Bi:1:006:2 -115 32 <
ffff890d2c1f6d80 3229965195 C Bi:1:006:2 0 1 = 10
ffff890d2c1f6d80 3229965231 S Bi:1:006:2 -115 32 <
ffff890e7cffd3c0 3229965354 S Bo:1:006:2 -115 4 = 55400220
ffff890e7cffd3c0 3229965484 C Bo:1:006:2 0 4 >
ffff890e2aadc480 3229967905 C Bi:1:006:2 0 2 = 1410
ffff890e2aadc480 3229967937 S Bi:1:006:2 -115 32 <
ffff890e7cffd3c0 3229968155 S Bo:1:006:2 -115 32 = 64008046 bc0185e2 91e00c94 2b018f92 9f92af92 bf920f93 1f93cf93 df93cdb7
ffff890e7cf9fcc0 3229968163 S Bo:1:006:2 -115 32 = deb7a197 0fb6f894 debf0fbe cdbf19a2 423008f4 4ae08e01 0f5d1f4f 842e912c
ffff890e7cffd3c0 3229968398 C Bo:1:006:2 0 32 >
ffff890e7cffd3c0 3229968411 S Bo:1:006:2 -115 32 = b12ca12c a5019401 0e949404 e62fb901 ca01ea30 f4f4e05d d801ee93 8d01232b
ffff890e7cf9fcc0 3229968424 C Bo:1:006:2 0 32 >
ffff890e7cf9fcc0 3229968426 S Bo:1:006:2 -115 32 = 242b252b 79f790e0 80e01097 19f0cd01 0e943802 a1960fb6 f894debf 0fbecdbf
ffff890e7cffd3c0 3229971315 C Bo:1:006:2 0 32 >
ffff890e7cffd3c0 3229971342 S Bo:1:006:2 -115 5 = df91cf91 20
ffff890e7cf9fcc0 3229974020 C Bo:1:006:2 0 32 >
ffff890e7cffd3c0 3229976829 C Bo:1:006:2 0 5 >
ffff890d2c1f6d80 3229981946 C Bi:1:006:2 0 1 = 14
ffff890d2c1f6d80 3229981981 S Bi:1:006:2 -115 32 <
ffff890e2aadc480 3229986440 C Bi:1:006:2 0 1 = 10
ffff890e2aadc480 3229986475 S Bi:1:006:2 -115 32 <
ffff890e7cffd3c0 3229986598 S Bo:1:006:2 -115 4 = 55800220
ffff890e7cffd3c0 3229986777 C Bo:1:006:2 0 4 >
ffff890d2c1f6d80 3229989073 C Bi:1:006:2 0 2 = 1410
ffff890d2c1f6d80 3229989108 S Bi:1:006:2 -115 32 <
ffff890e7cffd3c0 3229989243 S Bo:1:006:2 -115 32 = 64008046 1f910f91 bf90af90 9f908f90 0895e95c e1cfcf92 df92ef92 ff92cf93
ffff890e7cf9fcc0 3229989250 S Bo:1:006:2 -115 32 = df936b01 7c016de2 85e291e0 0e94cb01 ec016627 7727cb01 6c197d09 8e099f09
ffff890e7cffd3c0 3229989362 C Bo:1:006:2 0 32 >
ffff890e7cffd3c0 3229989372 S Bo:1:006:2 -115 32 = 4ae00e94 45028c0f 9d1fdf91 cf91ff90 ef90df90 cf900895 bc01990f 880b990b
ffff890e7cf9fcc0 3229989465 C Bo:1:006:2 0 32 >
ffff890e7cf9fcc0 3229989468 S Bo:1:006:2 -115 32 = 97fd0c94 89024ae0 0c944502 1f920f92 0fb60f92 11242f93 3f938f93 9f93af93
ffff890e7cffd3c0 3229992215 C Bo:1:006:2 0 32 >
ffff890e7cffd3c0 3229992220 S Bo:1:006:2 -115 5 = bf938091 20
ffff890e7cf9fcc0 3229995103 C Bo:1:006:2 0 32 >
ffff890e7cffd3c0 3229997867 C Bo:1:006:2 0 5 >
ffff890e2aadc480 3230003074 C Bi:1:006:2 0 1 = 14
ffff890e2aadc480 3230003109 S Bi:1:006:2 -115 32 <
ffff890d2c1f6d80 3230007114 C Bi:1:006:2 0 1 = 10
ffff890d2c1f6d80 3230007155 S Bi:1:006:2 -115 32 <
ffff890e7cffd3c0 3230007261 S Bo:1:006:2 -115 4 = 55c00220
ffff890e7cffd3c0 3230007472 C Bo:1:006:2 0 4 >
ffff890e2aadc480 3230009892 C Bi:1:006:2 0 2 = 1410
ffff890e2aadc480 3230009920 S Bi:1:006:2 -115 32 <
ffff890e7cffd3c0 3230010004 S Bo:1:006:2 -115 32 = 64008046 1d019091 1e01a091 1f01b091 20013091 1c0123e0 230f2d37 58f50196
ffff890e7cf9fcc0 3230010013 S Bo:1:006:2 -115 32 = a11db11d 20931c01 80931d01 90931e01 a0931f01 b0932001 80912101 90912201
ffff890e7cffd3c0 3230010259 C Bo:1:006:2 0 32 >
ffff890e7cffd3c0 3230010272 S Bo:1:006:2 -115 32 = a0912301 b0912401 0196a11d b11d8093 21019093 2201a093 2301b093 2401bf91
ffff890e7cf9fcc0 3230010283 C Bo:1:006:2 0 32 >
ffff890e7cf9fcc0 3230010285 S Bo:1:006:2 -115 32 = af919f91 8f913f91 2f910f90 0fbe0f90 1f901895 26e8230f 0296a11d b11dd2cf
ffff890e7cffd3c0 3230013004 C Bo:1:006:2 0 32 >
ffff890e7cffd3c0 3230013015 S Bo:1:006:2 -115 5 = 1f920f92 20
ffff890e7cf9fcc0 3230015766 C Bo:1:006:2 0 32 >
ffff890e7cffd3c0 3230018518 C Bo:1:006:2 0 5 >
ffff890d2c1f6d80 3230023870 C Bi:1:006:2 0 1 = 14
ffff890d2c1f6d80 3230023883 S Bi:1:006:2 -115 32 <
ffff890e2aadc480 3230028027 C Bi:1:006:2 0 1 = 10
ffff890e2aadc480 3230028073 S Bi:1:006:2 -115 32 <
ffff890e7cffd3c0 3230028148 S Bo:1:006:2 -115 4 = 55000320
ffff890e7cffd3c0 3230028397 C Bo:1:006:2 0 4 >
ffff890d2c1f6d80 3230030790 C Bi:1:006:2 0 2 = 1410
ffff890d2c1f6d80 3230030812 S Bi:1:006:2 -115 32 <
ffff890e7cffd3c0 3230030973 S Bo:1:006:2 -115 32 = 64008046 0fb60f92 11242f93 3f934f93 5f936f93 7f938f93 9f93af93 bf93ef93
ffff890e7cf9fcc0 3230030987 S Bo:1:006:2 -115 32 = ff9385e2 91e00e94 a901ff91 ef91bf91 af919f91 8f917f91 6f915f91 4f913f91
ffff890e7cffd3c0 3230031088 C Bo:1:006:2 0 32 >
ffff890e7cffd3c0 3230031091 S Bo:1:006:2 -115 32 = 2f910f90 0fbe0f90 1f901895 1f920f92 0fb60f92 11242f93 8f939f93 ef93ff93
ffff890e7cf9fcc0 3230031252 C Bo:1:006:2 0 32 >
ffff890e7cf9fcc0 3230031257 S Bo:1:006:2 -115 32 = e0913501 f0913601 8081e091 3b01f091 3c0182fd 1bc09081 80913e01 8f5f8f73
ffff890e7cffd3c0 3230034074 C Bo:1:006:2 0 32 >
ffff890e7cffd3c0 3230034097 S Bo:1:006:2 -115 5 = 20913f01 20
ffff890e7cf9fcc0 3230036786 C Bo:1:006:2 0 32 >
ffff890e7cffd3c0 3230039620 C Bo:1:006:2 0 5 >
ffff890e2aadc480 3230044788 C Bi:1:006:2 0 1 = 14
ffff890e2aadc480 3230044827 S Bi:1:006:2 -115 32 <
ffff890d2c1f6d80 3230049144 C Bi:1:006:2 0 1 = 10
ffff890d2c1f6d80 3230049162 S Bi:1:006:2 -115 32 <
ffff890e7cffd3c0 3230049280 S Bo:1:006:2 -115 4 = 55400320
ffff890e7cffd3c0 3230049526 C Bo:1:006:2 0 4 >
ffff890e2aadc480 3230051893 C Bi:1:006:2 0 2 = 1410
ffff890e2aadc480 3230051911 S Bi:1:006:2 -115 32 <
ffff890e7cffd3c0 3230052083 S Bo:1:006:2 -115 32 = 64008046 821741f0 e0913e01 f0e0eb5d fe4f958f 80933e01 ff91ef91 9f918f91
ffff890e7cf9fcc0 3230052096 S Bo:1:006:2 -115 32 = 2f910f90 0fbe0f90 1f901895 8081f4cf 789484b5 826084bd 84b58160 84bd85b5
ffff890e7cffd3c0 3230052392 C Bo:1:006:2 0 32 >
ffff890e7cffd3c0 3230052405 S Bo:1:006:2 -115 32 = 826085bd 85b58160 85bd8091 6e008160 80936e00 10928100 80918100 82608093
ffff890e7cf9fcc0 3230052416 C Bo:1:006:2 0 32 >
ffff890e7cf9fcc0 3230052418 S Bo:1:006:2 -115 32 = 81008091 81008160 80938100 80918000 81608093 80008091 b1008460 8093b100
ffff890e7cffd3c0 3230055190 C Bo:1:006:2 0 32 >
ffff890e7cffd3c0 3230055219 S Bo:1:006:2 -115 5 = 8091b000 20
ffff890e7cf9fcc0 3230058022 C Bo:1:006:2 0 32 >
ffff890e7cffd3c0 3230060825 C Bo:1:006:2 0 5 >
ffff890d2c1f6d80 3230065940 C Bi:1:006:2 0 1 = 14
ffff890d2c1f6d80 3230065976 S Bi:1:006:2 -115 32 <
ffff890e2aadc480 3230070476 C Bi:1:006:2 0 1 = 10
ffff890e2aadc480 3230070511 S Bi:1:006:2 -115 32 <
ffff890e7cffd3c0 3230070649 S Bo:1:006:2 -115 4 = 55800320
ffff890e7cffd3c0 3230070904 C Bo:1:006:2 0 4 >
ffff890d2c1f6d80 3230073393 C Bi:1:006:2 0 2 = 1410
ffff890d2c1f6d80 3230073411 S Bi:1:006:2 -115 32 <
ffff890e7cffd3c0 3230073533 S Bo:1:006:2 -115 32 = 64008046 81608093 b0008091 7a008460 80937a00 80917a00 82608093 7a008091
ffff890e7cf9fcc0 3230073547 S Bo:1:006:2 -115 32 = 7a008160 80937a00 80917a00 80688093 7a001092 c100e091 3501f091 360182e0
ffff890e7cffd3c0 3230073765 C Bo:1:006:2 0 32 >
ffff890e7cffd3c0 3230073777 S Bo:1:006:2 -115 32 = 8083e091 3101f091 32011082 e0913301 f0913401 8fec8083 10923d01 e0913901
ffff890e7cf9fcc0 3230073788 C Bo:1:006:2 0 32 >
ffff890e7cf9fcc0 3230073790 S Bo:1:006:2 -115 32 = f0913a01 86e08083 e0913701 f0913801 80818061 8083e091 3701f091 38018081
ffff890e7cffd3c0 3230076519 C Bo:1:006:2 0 32 >
ffff890e7cffd3c0 3230076537 S Bo:1:006:2 -115 5 = 88608083 20
ffff890e7cf9fcc0 3230079396 C Bo:1:006:2 0 32 >
ffff890e7cffd3c0 3230082151 C Bo:1:006:2 0 5 >
ffff890e2aadc480 3230087482 C Bi:1:006:2 0 1 = 14
ffff890e2aadc480 3230087519 S Bi:1:006:2 -115 32 <
ffff890d2c1f6d80 3230091522 C Bi:1:006:2 0 1 = 10
ffff890d2c1f6d80 3230091556 S Bi:1:006:2 -115 32 <
ffff890e7cffd3c0 3230091705 S Bo:1:006:2 -115 4 = 55c00320
ffff890e7cffd3c0 3230091858 C Bo:1:006:2 0 4 >
ffff890e2aadc480 3230094312 C Bi:1:006:2 0 2 = 1410
ffff890e2aadc480 3230094337 S Bi:1:006:2 -115 32 <
ffff890e7cffd3c0 3230094482 S Bo:1:006:2 -115 32 = 64008046 e0913701 f0913801 80818068 8083e091 3701f091 38018081 8f7d8083
ffff890e7cf9fcc0 3230094497 S Bo:1:006:2 -115 32 = ede9f0e0 2491e9e8 f0e08491 882399f0 90e0880f 991ffc01 e859ff4f a591b491
ffff890e7cffd3c0 3230094592 C Bo:1:006:2 0 32 >
ffff890e7cffd3c0 3230094595 S Bo:1:006:2 -115 32 = fc01ee58 ff4f8591 94918fb7 f894ec91 e22bec93 8fbfc8ee d3e000e0 10e0ee24
ffff890e7cf9fcc0 3230094711 C Bo:1:006:2 0 32 >
ffff890e7cf9fcc0 3230094714 S Bo:1:006:2 -115 32 = e394f12c 81e090e0 0e94aa02 84e191e0 0e943802 61e08de0 0e948700 80910001
ffff890e7cffd3c0 3230097574 C Bo:1:006:2 0 32 >
ffff890e7cffd3c0 3230097603 S Bo:1:006:2 -115 5 = 90910101 20
ffff890e7cf9fcc0 3230100323 C Bo:1:006:2 0 32 >
ffff890e7cffd3c0 3230103025 C Bo:1:006:2 0 5 >
ffff890d2c1f6d80 3230108356 C Bi:1:006:2 0 1 = 14
ffff890d2c1f6d80 3230108393 S Bi:1:006:2 -115 32 <
ffff890e2aadc480 3230112694 C Bi:1:006:2 0 1 = 10
ffff890e2aadc480 3230112726 S Bi:1:006:2 -115 32 <
ffff890e7cffd3c0 3230112872 S Bo:1:006:2 -115 4 = 55000420
ffff890e7cffd3c0 3230112971 C Bo:1:006:2 0 4 >
ffff890d2c1f6d80 3230115481 C Bi:1:006:2 0 2 = 1410
ffff890d2c1f6d80 3230115515 S Bi:1:006:2 -115 32 <
ffff890e7cffd3c0 3230115668 S Bo:1:006:2 -115 32 = 64008046 8c9fb001 8d9f700d 9c9f700d 1124072e 000c880b 990b0e94 f80090e0
ffff890e7cf9fcc0 3230115678 S Bo:1:006:2 -115 32 = 80e00e94 aa0284e1 91e00e94 380260e0 8de00e94 870068ee 73e080e0 90e00e94
ffff890e7cffd3c0 3230115887 C Bo:1:006:2 0 32 >
ffff890e7cffd3c0 3230115900 S Bo:1:006:2 -115 32 = f80085e2 91e00e94 89011816 190624f5 85e291e0 0e946701 90930101 80930001
ffff890e7cf9fcc0 3230115912 C Bo:1:006:2 0 32 >
ffff890e7cf9fcc0 3230115914 S Bo:1:006:2 -115 32 = bc01990f 880b990b 97ff12c0 0e948902 86e191e0 0e943802 80910001 90910101
ffff890e7cffd3c0 3230118814 C Bo:1:006:2 0 32 >
ffff890e7cffd3c0 3230118842 S Bo:1:006:2 -115 5 = 18161906 20
ffff890e7cf9fcc0 3230121523 C Bo:1:006:2 0 32 >
ffff890e7cffd3c0 3230124281 C Bo:1:006:2 0 5 >
ffff890e2aadc480 3230129482 C Bi:1:006:2 0 1 = 14
ffff890e2aadc480 3230129519 S Bi:1:006:2 -115 32 <
ffff890d2c1f6d80 3230133782 C Bi:1:006:2 0 1 = 10
ffff890d2c1f6d80 3230133814 S Bi:1:006:2 -115 32 <
ffff890e7cffd3c0 3230133958 S Bo:1:006:2 -115 4 = 55400420
ffff890e7cffd3c0 3230134108 C Bo:1:006:2 0 4 >
ffff890e2aadc480 3230136608 C Bi:1:006:2 0 2 = 1410
ffff890e2aadc480 3230136643 S Bi:1:006:2 -115 32 <
ffff890e7cffd3c0 3230136799 S Bo:1:006:2 -115 32 = 64008046 f4f2f092 0101e092 0001d9cf 4ae00e94 4502eccf 80911a01 90911b01
ffff890e7cf9fcc0 3230136809 S Bo:1:006:2 -115 32 = 9c012f5f 3f4f3093 1b012093 1a010e94 aa0288e1 91e00e94 38020115 110509f4
ffff890e7cffd3c0 3230136966 C Bo:1:006:2 0 32 >
ffff890e7cffd3c0 3230136974 S Bo:1:006:2 -115 32 = 91cf0e94 95018823 09f48ccf 0e940000 89cfe5e2 f1e01382 128288ee 93e0a0e0
ffff890e7cf9fcc0 3230136982 C Bo:1:006:2 0 32 >
ffff890e7cf9fcc0 3230136984 S Bo:1:006:2 -115 32 = b0e08483 9583a683 b78386e0 91e09183 808385ec 90e09587 848784ec 90e09787
ffff890e7cffd3c0 3230139943 C Bo:1:006:2 0 32 >
ffff890e7cffd3c0 3230139971 S Bo:1:006:2 -115 5 = 868780ec 20
ffff890e7cf9fcc0 3230142690 C Bo:1:006:2 0 32 >
ffff890e7cffd3c0 3230145454 C Bo:1:006:2 0 5 >
ffff890d2c1f6d80 3230150608 C Bi:1:006:2 0 1 = 14
ffff890d2c1f6d80 3230150643 S Bi:1:006:2 -115 32 <
ffff890e2aadc480 3230155065 C Bi:1:006:2 0 1 = 10
ffff890e2aadc480 3230155099 S Bi:1:006:2 -115 32 <
ffff890e7cffd3c0 3230155283 S Bo:1:006:2 -115 4 = 55800420
ffff890e7cffd3c0 3230155529 C Bo:1:006:2 0 4 >
ffff890d2c1f6d80 3230158020 C Bi:1:006:2 0 2 = 1410
ffff890d2c1f6d80 3230158039 S Bi:1:006:2 -115 32 <
ffff890e7cffd3c0 3230158203 S Bo:1:006:2 -115 32 = 64008046 90e0918b 808b81ec 90e0938b 828b82ec 90e0958b 848b86ec 90e0978b
ffff890e7cf9fcc0 3230158220 S Bo:1:006:2 -115 32 = 868b118e 128e138e 148e0895 a1e21a2e aa1bbb1b fd010dc0 aa1fbb1f ee1fff1f
ffff890e7cffd3c0 3230158384 C Bo:1:006:2 0 32 >
ffff890e7cffd3c0 3230158396 S Bo:1:006:2 -115 32 = a217b307 e407f507 20f0a21b b30be40b f50b661f 771f881f 991f1a94 69f76095
ffff890e7cf9fcc0 3230158408 C Bo:1:006:2 0 32 >
ffff890e7cf9fcc0 3230158410 S Bo:1:006:2 -115 32 = 70958095 90959b01 ac01bd01 cf010895 ee0fff1f 0590f491 e02d0994 f894ffcf
ffff890e7cffd3c0 3230161357 C Bo:1:006:2 0 32 >
ffff890e7cffd3c0 3230161384 S Bo:1:006:2 -115 5 = 01000000 20
ffff890e7cf9fcc0 3230164105 C Bo:1:006:2 0 32 >
ffff890e7cffd3c0 3230166860 C Bo:1:006:2 0 5 >
ffff890e2aadc480 3230172224 C Bi:1:006:2 0 1 = 14
ffff890e2aadc480 3230172248 S Bi:1:006:2 -115 32 <
ffff890d2c1f6d80 3230176524 C Bi:1:006:2 0 1 = 10
ffff890d2c1f6d80 3230176546 S Bi:1:006:2 -115 32 <
ffff890e7cffd3c0 3230176721 S Bo:1:006:2 -115 4 = 55c00420
ffff890e7cffd3c0 3230176871 C Bo:1:006:2 0 4 >
ffff890e2aadc480 3230179315 C Bi:1:006:2 0 2 = 1410
ffff890e2aadc480 3230179350 S Bi:1:006:2 -115 32 <
ffff890e7cffd3c0 3230179536 S Bo:1:006:2 -115 32 = 64008046 0000cb01 2b015801 18028901 67017b01 61006200 6300ffff ffffffff
ffff890e7cf9fcc0 3230179555 S Bo:1:006:2 -115 32 = ffffffff ffffffff ffffffff ffffffff ffffffff ffffffff ffffffff ffffffff
ffff890e7cffd3c0 3230179765 C Bo:1:006:2 0 32 >
ffff890e7cffd3c0 3230179780 S Bo:1:006:2 -115 32 = ffffffff ffffffff ffffffff ffffffff ffffffff ffffffff ffffffff ffffffff
ffff890e7cf9fcc0 3230179794 C Bo:1:006:2 0 32 >
ffff890e7cf9fcc0 3230179796 S Bo:1:006:2 -115 32 = ffffffff ffffffff ffffffff ffffffff ffffffff ffffffff ffffffff ffffffff
ffff890e7cffd3c0 3230182698 C Bo:1:006:2 0 32 >
ffff890e7cffd3c0 3230182725 S Bo:1:006:2 -115 5 = ffffffff 20
ffff890e7cf9fcc0 3230185446 C Bo:1:006:2 0 32 >
ffff890e7cffd3c0 3230188240 C Bo:1:006:2 0 5 >
ffff890d2c1f6d80 3230193321 C Bi:1:006:2 0 1 = 14
ffff890d2c1f6d80 3230193355 S Bi:1:006:2 -115 32 <
ffff890e2aadc480 3230197695 C Bi:1:006:2 0 1 = 10
ffff890e2aadc480 3230197729 S Bi:1:006:2 -115 32 <
ffff890e7cffd3c0 3230198617 S Bo:1:006:2 -115 4 = 55000020
ffff890e7cffd3c0 3230198731 C Bo:1:006:2 0 4 >
ffff890d2c1f6d80 3230201479 C Bi:1:006:2 0 2 = 1410
ffff890d2c1f6d80 3230201513 S Bi:1:006:2 -115 32 <
ffff890e7cffd3c0 3230201698 S Bo:1:006:2 -115 5 = 74008046 20
ffff890e7cffd3c0 3230201883 C Bo:1:006:2 0 5 >
ffff890e2aadc480 3230205193 C Bi:1:006:2 0 32 = 140c945d 000c9485 000c9485 000c9485 000c9485 000c9485 000c9485 000c9485
ffff890e2aadc480 3230205227 S Bi:1:006:2 -115 32 <
ffff890d2c1f6d80 3230207814 C Bi:1:006:2 0 32 = 000c9485 000c9485 000c9485 000c9485 000c9485 000c9485 000c9485 000c9485
ffff890d2c1f6d80 3230207849 S Bi:1:006:2 -115 32 <
ffff890e2aadc480 3230210564 C Bi:1:006:2 0 32 = 000c94b4 020c9485 000c9424 030c94fe 020c9485 000c9485 000c9485 000c9485
ffff890e2aadc480 3230210599 S Bi:1:006:2 -115 32 <
ffff890d2c1f6d80 3230213275 C Bi:1:006:2 0 32 = 000c9485 000c9485 00000000 00240027 002a0000 00000025 0028002b 00040404
ffff890d2c1f6d80 3230213304 S Bi:1:006:2 -115 32 <
ffff890e2aadc480 3230215392 C Bi:1:006:2 0 2 = 0410
ffff890e2aadc480 3230215410 S Bi:1:006:2 -115 32 <
ffff890e7cffd3c0 3230215538 S Bo:1:006:2 -115 4 = 55400020
ffff890e7cffd3c0 3230215739 C Bo:1:006:2 0 4 >
ffff890d2c1f6d80 3230218142 C Bi:1:006:2 0 2 = 1410
ffff890d2c1f6d80 3230218160 S Bi:1:006:2 -115 32 <
ffff890e7cffd3c0 3230218317 S Bo:1:006:2 -115 5 = 74008046 20
ffff890e7cffd3c0 3230218511 C Bo:1:006:2 0 5 >
ffff890e2aadc480 3230221816 C Bi:1:006:2 0 32 = 14040404 04020202 02020203 03030303 03010204 08102040 80010204 08102001
ffff890e2aadc480 3230221850 S Bi:1:006:2 -115 32 <
ffff890d2c1f6d80 3230224405 C Bi:1:006:2 0 32 = 02040810 20000000 08000201 00000304 07000000 00000000 00670411 241fbecf
ffff890d2c1f6d80 3230224427 S Bi:1:006:2 -115 32 <
ffff890e2aadc480 3230227145 C Bi:1:006:2 0 32 = efd8e0de bfcdbf11 e0a0e0b1 e0ece7f9 e002c005 900d92aa 31b107d9 f721e0aa
ffff890e2aadc480 3230227169 S Bi:1:006:2 -115 32 <
ffff890d2c1f6d80 3230229860 C Bi:1:006:2 0 32 = e1b1e001 c01d92a2 3cb207e1 f710e0cd e5d0e004 c02197fe 010e94b6 04cc35d1
ffff890d2c1f6d80 3230229895 S Bi:1:006:2 -115 32 <
ffff890e2aadc480 3230231812 C Bi:1:006:2 0 2 = 0710
ffff890e2aadc480 3230231843 S Bi:1:006:2 -115 32 <
ffff890e7cffd3c0 3230231978 S Bo:1:006:2 -115 4 = 55800020
ffff890e7cffd3c0 3230232101 C Bo:1:006:2 0 4 >
ffff890d2c1f6d80 3230234603 C Bi:1:006:2 0 2 = 1410
ffff890d2c1f6d80 3230234638 S Bi:1:006:2 -115 32 <
ffff890e7cffd3c0 3230234768 S Bo:1:006:2 -115 5 = 74008046 20
ffff890e7cffd3c0 3230235013 C Bo:1:006:2 0 5 >
ffff890e2aadc480 3230238226 C Bi:1:006:2 0 32 = 14c9f70e 9456030c 94bc040c 94000090 e0fc01ec 55ff4f24 91fc01e0 57ff4f34
ffff890e2aadc480 3230238263 S Bi:1:006:2 -115 32 <
ffff890d2c1f6d80 3230240931 C Bi:1:006:2 0 32 = 91fc01e4 58ff4fe4 91ee23c9 f0222339 f0233001 f1a8f421 3019f122 3029f1f0
ffff890d2c1f6d80 3230240966 S Bi:1:006:2 -115 32 <
ffff890e2aadc480 3230243728 C Bi:1:006:2 0 32 = e0ee0fff 1fee58ff 4fa591b4 918fb7f8 94ec9161 1126c030 953e233c 938fbf08
ffff890e2aadc480 3230243763 S Bi:1:006:2 -115 32 <
ffff890d2c1f6d80 3230246341 C Bi:1:006:2 0 32 = 952730a9 f02830c9 f0243049 f7809180 008f7d03 c0809180 008f7780 938000df
ffff890d2c1f6d80 3230246371 S Bi:1:006:2 -115 32 <
ffff890e2aadc480 3230248523 C Bi:1:006:2 0 2 = cf10
ffff890e2aadc480 3230248543 S Bi:1:006:2 -115 32 <
ffff890e7cffd3c0 3230248632 S Bo:1:006:2 -115 4 = 55c00020
ffff890e7cffd3c0 3230248721 C Bo:1:006:2 0 4 >
ffff890d2c1f6d80 3230251350 C Bi:1:006:2 0 2 = 1410
ffff890d2c1f6d80 3230251384 S Bi:1:006:2 -115 32 <
ffff890e7cffd3c0 3230251512 S Bo:1:006:2 -115 5 = 74008046 20
ffff890e7cffd3c0 3230251771 C Bo:1:006:2 0 5 >
ffff890e2aadc480 3230254944 C Bi:1:006:2 0 32 = 1484b58f 7784bddb cf84b58f 7dfbcf80 91b0008f 778093b0 00d2cf80 91b0008f
ffff890e2aadc480 3230254979 S Bi:1:006:2 -115 32 <
ffff890d2c1f6d80 3230257651 C Bi:1:006:2 0 32 = 7df9cf3e 2bdacf3f b7f89480 91210190 912201a0 912301b0 91240126 b5a89b05
ffff890d2c1f6d80 3230257675 S Bi:1:006:2 -115 32 <
ffff890e2aadc480 3230260482 C Bi:1:006:2 0 32 = c02f3f19 f00196a1 1db11d3f bfba2fa9 2f982f88 27bc01cd 01620f71 1d811d91
ffff890e2aadc480 3230260518 S Bi:1:006:2 -115 32 <
ffff890d2c1f6d80 3230262992 C Bi:1:006:2 0 32 = 1d42e066 0f771f88 1f991f4a 95d1f708 958f929f 92af92bf 92cf92df 92ef92ff
ffff890d2c1f6d80 3230263025 S Bi:1:006:2 -115 32 <
ffff890e2aadc480 3230265322 C Bi:1:006:2 0 2 = 9210
ffff890e2aadc480 3230265356 S Bi:1:006:2 -115 32 <
ffff890e7cffd3c0 3230265492 S Bo:1:006:2 -115 4 = 55000120
ffff890e7cffd3c0 3230265618 C Bo:1:006:2 0 4 >
ffff890d2c1f6d80 3230268104 C Bi:1:006:2 0 2 = 1410
ffff890d2c1f6d80 3230268139 S Bi:1:006:2 -115 32 <
ffff890e7cffd3c0 3230268274 S Bo:1:006:2 -115 5 = 74008046 20
ffff890e7cffd3c0 3230268523 C Bo:1:006:2 0 5 >
ffff890e2aadc480 3230271689 C Bi:1:006:2 0 32 = 146b017c 010e94d3 004b015c 01c114d1 04e104f1 04b9f00e 94d30068 1979098a
ffff890e2aadc480 3230271726 S Bi:1:006:2 -115 32 <
ffff890d2c1f6d80 3230274439 C Bi:1:006:2 0 32 = 099b0968 3e734081 05910580 f321e0c2 1ad108e1 08f10888 ee880e83 e0981ea1
ffff890d2c1f6d80 3230274471 S Bi:1:006:2 -115 32 <
ffff890e2aadc480 3230277232 C Bi:1:006:2 0 32 = 1cb11ce4 cfff90ef 90df90cf 90bf90af 909f908f 900895af 92bf92cf 92df92ef
ffff890e2aadc480 3230277268 S Bi:1:006:2 -115 32 <
ffff890d2c1f6d80 3230279738 C Bi:1:006:2 0 32 = 92ff920f 931f93cf 93df936c 017b018b 01040f15 1feb015e 01ae18bf 08c017d1
ffff890d2c1f6d80 3230279773 S Bi:1:006:2 -115 32 <
ffff890e2aadc480 3230282107 C Bi:1:006:2 0 2 = 0710
ffff890e2aadc480 3230282143 S Bi:1:006:2 -115 32 <
ffff890e7cffd3c0 3230282276 S Bo:1:006:2 -115 4 = 55400120
ffff890e7cffd3c0 3230282528 C Bo:1:006:2 0 4 >
ffff890d2c1f6d80 3230285016 C Bi:1:006:2 0 2 = 1410
ffff890d2c1f6d80 3230285034 S Bi:1:006:2 -115 32 <
ffff890e7cffd3c0 3230285117 S Bo:1:006:2 -115 5 = 74008046 20
ffff890e7cffd3c0 3230285394 C Bo:1:006:2 0 5 >
ffff890e2aadc480 3230288569 C Bi:1:006:2 0 32 = 1459f069 91d601ed 91fc9101 90f081e0 2dc60109 95892b79 f7c501df 91cf911f
ffff890e2aadc480 3230288603 S Bi:1:006:2 -115 32 <
ffff890d2c1f6d80 3230291352 C Bi:1:006:2 0 32 = 910f91ff 90ef90df 90cf90bf 90af9008 95fc0153 8d448d25 2f30e084 2f90e082
ffff890d2c1f6d80 3230291387 S Bi:1:006:2 -115 32 <
ffff890e2aadc480 3230294068 C Bi:1:006:2 0 32 = 1b930b54 1710f0cf 96089501 970895fc 01918d82 8d981761 f0a28dae 0fbf2fb1
ffff890e2aadc480 3230294101 S Bi:1:006:2 -115 32 <
ffff890d2c1f6d80 3230296863 C Bi:1:006:2 0 32 = 1d5d968c 91928d9f 5f9f7392 8f90e008 958fef9f ef0895fc 01918d82 8d981731
ffff890d2c1f6d80 3230296898 S Bi:1:006:2 -115 32 <
ffff890e2aadc480 3230298653 C Bi:1:006:2 0 2 = f010
ffff890e2aadc480 3230298672 S Bi:1:006:2 -115 32 <
ffff890e7cffd3c0 3230298760 S Bo:1:006:2 -115 4 = 55800120
ffff890e7cffd3c0 3230299023 C Bo:1:006:2 0 4 >
ffff890d2c1f6d80 3230301395 C Bi:1:006:2 0 2 = 1410
ffff890d2c1f6d80 3230301413 S Bi:1:006:2 -115 32 <
ffff890e7cffd3c0 3230301497 S Bo:1:006:2 -115 5 = 74008046 20
ffff890e7cffd3c0 3230301609 C Bo:1:006:2 0 5 >
ffff890e2aadc480 3230304981 C Bi:1:006:2 0 32 = 14828de8 0ff11d85 8d90e008 958fef9f ef0895fc 01918d22 8d892f90 e0805c9f
ffff890e2aadc480 3230305018 S Bi:1:006:2 -115 32 <
ffff890d2c1f6d80 3230307726 C Bi:1:006:2 0 32 = 4f821b91 098f7399 27089585 e291e00e 94890121 e0892b09 f420e082 2f089580
ffff890d2c1f6d80 3230307762 S Bi:1:006:2 -115 32 <
ffff890e2aadc480 3230310486 C Bi:1:006:2 0 32 = e090e089 2b29f00e 94950181 110c9400 000895fc 01a48da8 0fb92fb1 1da35abf
ffff890e2aadc480 3230310521 S Bi:1:006:2 -115 32 <
ffff890d2c1f6d80 3230313131 C Bi:1:006:2 0 32 = 4f2c9184 8d90e001 968f7399 27848fa6 89b7892c 93a089b1 898c9183 7080648c
ffff890d2c1f6d80 3230313164 S Bi:1:006:2 -115 32 <
ffff890e2aadc480 3230315066 C Bi:1:006:2 0 2 = 9310
ffff890e2aadc480 3230315102 S Bi:1:006:2 -115 32 <
ffff890e7cffd3c0 3230315240 S Bo:1:006:2 -115 4 = 55c00120
ffff890e7cffd3c0 3230315367 C Bo:1:006:2 0 4 >
ffff890d2c1f6d80 3230317819 C Bi:1:006:2 0 2 = 1410
ffff890d2c1f6d80 3230317854 S Bi:1:006:2 -115 32 <
ffff890e7cffd3c0 3230317986 S Bo:1:006:2 -115 5 = 74008046 20
ffff890e7cffd3c0 3230318107 C Bo:1:006:2 0 5 >
ffff890e2aadc480 3230321482 C Bi:1:006:2 0 32 = 14938d84 8d981306 c00288f3 89e02d80 818f7d80 830895ef 92ff920f 931f93cf
ffff890e2aadc480 3230321518 S Bi:1:006:2 -115 32 <
ffff890d2c1f6d80 3230324231 C Bi:1:006:2 0 32 = 93df93ec 0181e088 8f9b8d8c 8d98131a c0e889f9 89808185 ff15c09f b7f894ee
ffff890d2c1f6d80 3230324267 S Bi:1:006:2 -115 32 <
ffff890e2aadc480 3230326817 C Bi:1:006:2 0 32 = 89ff8960 83e889f9 89808183 70806480 839fbf81 e090e0df 91cf911f 910f91ff
ffff890e2aadc480 3230326855 S Bi:1:006:2 -115 32 <
ffff890d2c1f6d80 3230329516 C Bi:1:006:2 0 32 = 90ef9008 95f62e0b 8d10e00f 5f1f4f0f 731127e0 2e8c8d8e 110cc00f b607fcfa
ffff890d2c1f6d80 3230329537 S Bi:1:006:2 -115 32 <
ffff890e2aadc480 3230331439 C Bi:1:006:2 0 2 = cf10
ffff890e2aadc480 3230331474 S Bi:1:006:2 -115 32 <
ffff890e7cffd3c0 3230331601 S Bo:1:006:2 -115 4 = 55000220
ffff890e7cffd3c0 3230331728 C Bo:1:006:2 0 4 >
ffff890d2c1f6d80 3230334195 C Bi:1:006:2 0 2 = 1410
ffff890d2c1f6d80 3230334230 S Bi:1:006:2 -115 32 <
ffff890e7cffd3c0 3230334361 S Bo:1:006:2 -115 5 = 74008046 20
ffff890e7cffd3c0 3230334482 C Bo:1:006:2 0 5 >
ffff890e2aadc480 3230337814 C Bi:1:006:2 0 32 = 14e889f9 89808185 fff5cfce 010e94a9 01f1cfeb 8dec0ffd 2ff11de3 5aff4ff0
ffff890e2aadc480 3230337847 S Bi:1:006:2 -115 32 <
ffff890d2c1f6d80 3230340522 C Bi:1:006:2 0 32 = 829fb7f8 940b8fea 89fb8980 818062cf cfcf93df 93ec0188 8d8823b9 f0aa89bb
ffff890d2c1f6d80 3230340541 S Bi:1:006:2 -115 32 <
ffff890e2aadc480 3230343195 C Bi:1:006:2 0 32 = 89e889f9 898c9185 fd03c080 8186fd0d c00fb607 fcf7cf8c 9185fff2 cf808185
ffff890e2aadc480 3230343230 S Bi:1:006:2 -115 32 <
ffff890d2c1f6d80 3230345908 C Bi:1:006:2 0 32 = ffedcfce 010e94a9 01e9cfdf 91cf9108 95fc0101 900020e9 f73197af 01481b59
ffff890d2c1f6d80 3230345983 S Bi:1:006:2 -115 32 <
ffff890e2aadc480 3230347892 C Bi:1:006:2 0 2 = 0b10
ffff890e2aadc480 3230347911 S Bi:1:006:2 -115 32 <
ffff890e7cffd3c0 3230347998 S Bo:1:006:2 -115 4 = 55400220
ffff890e7cffd3c0 3230348268 C Bo:1:006:2 0 4 >
ffff890d2c1f6d80 3230350522 C Bi:1:006:2 0 2 = 1410
ffff890d2c1f6d80 3230350550 S Bi:1:006:2 -115 32 <
ffff890e7cffd3c0 3230350660 S Bo:1:006:2 -115 5 = 74008046 20
ffff890e7cffd3c0 3230350892 C Bo:1:006:2 0 5 >
ffff890e2aadc480 3230354106 C Bi:1:006:2 0 32 = 14bc0185 e291e00c 942b018f 929f92af 92bf920f 931f93cf 93df93cd b7deb7a1
ffff890e2aadc480 3230354140 S Bi:1:006:2 -115 32 <
ffff890d2c1f6d80 3230356780 C Bi:1:006:2 0 32 = 970fb6f8 94debf0f becdbf19 a2423008 f44ae08e 010f5d1f 4f842e91 2cb12ca1
ffff890d2c1f6d80 3230356800 S Bi:1:006:2 -115 32 <
ffff890e2aadc480 3230359563 C Bi:1:006:2 0 32 = 2ca50194 010e9494 04e62fb9 01ca01ea 30f4f4e0 5dd801ee 938d0123 2b242b25
ffff890e2aadc480 3230359599 S Bi:1:006:2 -115 32 <
ffff890d2c1f6d80 3230362361 C Bi:1:006:2 0 32 = 2b79f790 e080e010 9719f0cd 010e9438 02a1960f b6f894de bf0fbecd bfdf91cf
ffff890d2c1f6d80 3230362395 S Bi:1:006:2 -115 32 <
ffff890e2aadc480 3230364319 C Bi:1:006:2 0 2 = 9110
ffff890e2aadc480 3230364354 S Bi:1:006:2 -115 32 <
ffff890e7cffd3c0 3230364485 S Bo:1:006:2 -115 4 = 55800220
ffff890e7cffd3c0 3230364613 C Bo:1:006:2 0 4 >
ffff890d2c1f6d80 3230367102 C Bi:1:006:2 0 2 = 1410
ffff890d2c1f6d80 3230367137 S Bi:1:006:2 -115 32 <
ffff890e7cffd3c0 3230367265 S Bo:1:006:2 -115 5 = 74008046 20
ffff890e7cffd3c0 3230367521 C Bo:1:006:2 0 5 >
ffff890e2aadc480 3230370727 C Bi:1:006:2 0 32 = 141f910f 91bf90af 909f908f 900895e9 5ce1cfcf 92df92ef 92ff92cf 93df936b
ffff890e2aadc480 3230370763 S Bi:1:006:2 -115 32 <
ffff890d2c1f6d80 3230373484 C Bi:1:006:2 0 32 = 017c016d e285e291 e00e94cb 01ec0166 277727cb 016c197d 098e099f 094ae00e
ffff890d2c1f6d80 3230373518 S Bi:1:006:2 -115 32 <
ffff890e2aadc480 3230376231 C Bi:1:006:2 0 32 = 9445028c 0f9d1fdf 91cf91ff 90ef90df 90cf9008 95bc0199 0f880b99 0b97fd0c
ffff890e2aadc480 3230376266 S Bi:1:006:2 -115 32 <
ffff890d2c1f6d80 3230378743 C Bi:1:006:2 0 32 = 9489024a e00c9445 021f920f 920fb60f 9211242f 933f938f 939f93af 93bf9380
ffff890d2c1f6d80 3230378777 S Bi:1:006:2 -115 32 <
ffff890e2aadc480 3230380981 C Bi:1:006:2 0 2 = 9110
ffff890e2aadc480 3230381018 S Bi:1:006:2 -115 32 <
ffff890e7cffd3c0 3230381152 S Bo:1:006:2 -115 4 = 55c00220
ffff890e7cffd3c0 3230381403 C Bo:1:006:2 0 4 >
ffff890d2c1f6d80 3230383642 C Bi:1:006:2 0 2 = 1410
ffff890d2c1f6d80 3230383660 S Bi:1:006:2 -115 32 <
ffff890e7cffd3c0 3230383742 S Bo:1:006:2 -115 5 = 74008046 20
ffff890e7cffd3c0 3230383854 C Bo:1:006:2 0 5 >
ffff890e2aadc480 3230387194 C Bi:1:006:2 0 32 = 141d0190 911e01a0 911f01b0 91200130 911c0123 e0230f2d 3758f501 96a11db1
ffff890e2aadc480 3230387228 S Bi:1:006:2 -115 32 <
ffff890d2c1f6d80 3230389977 C Bi:1:006:2 0 32 = 1d20931c 0180931d 0190931e 01a0931f 01b09320 01809121 01909122 01a09123
ffff890d2c1f6d80 3230390012 S Bi:1:006:2 -115 32 <
ffff890e2aadc480 3230392606 C Bi:1:006:2 0 32 = 01b09124 010196a1 1db11d80 93210190 932201a0 932301b0 932401bf 91af919f
ffff890e2aadc480 3230392642 S Bi:1:006:2 -115 32 <
ffff890d2c1f6d80 3230395353 C Bi:1:006:2 0 32 = 918f913f 912f910f 900fbe0f 901f9018 9526e823 0f0296a1 1db11dd2 cf1f920f
ffff890d2c1f6d80 3230395388 S Bi:1:006:2 -115 32 <
ffff890e2aadc480 3230397400 C Bi:1:006:2 0 2 = 9210
ffff890e2aadc480 3230397419 S Bi:1:006:2 -115 32 <
ffff890e7cffd3c0 3230397509 S Bo:1:006:2 -115 4 = 55000320
ffff890e7cffd3c0 3230397776 C Bo:1:006:2 0 4 >
ffff890d2c1f6d80 3230400018 C Bi:1:006:2 0 2 = 1410
ffff890d2c1f6d80 3230400035 S Bi:1:006:2 -115 32 <
ffff890e7cffd3c0 3230400120 S Bo:1:006:2 -115 5 = 74008046 20
ffff890e7cffd3c0 3230400395 C Bo:1:006:2 0 5 >
ffff890e2aadc480 3230403564 C Bi:1:006:2 0 32 = 140fb60f 9211242f 933f934f 935f936f 937f938f 939f93af 93bf93ef 93ff9385
ffff890e2aadc480 3230403600 S Bi:1:006:2 -115 32 <
ffff890d2c1f6d80 3230406275 C Bi:1:006:2 0 32 = e291e00e 94a901ff 91ef91bf 91af919f 918f917f 916f915f 914f913f 912f910f
ffff890d2c1f6d80 3230406311 S Bi:1:006:2 -115 32 <
ffff890e2aadc480 3230408969 C Bi:1:006:2 0 32 = 900fbe0f 901f9018 951f920f 920fb60f 9211242f 938f939f 93ef93ff 93e09135
ffff890e2aadc480 3230408985 S Bi:1:006:2 -115 32 <
ffff890d2c1f6d80 3230411715 C Bi:1:006:2 0 32 = 01f09136 018081e0 913b01f0 913c0182 fd1bc090 8180913e 018f5f8f 7320913f
ffff890d2c1f6d80 3230411725 S Bi:1:006:2 -115 32 <
ffff890e2aadc480 3230413718 C Bi:1:006:2 0 2 = 0110
ffff890e2aadc480 3230413728 S Bi:1:006:2 -115 32 <
ffff890e7cffd3c0 3230413781 S Bo:1:006:2 -115 4 = 55400320
ffff890e7cffd3c0 3230414015 C Bo:1:006:2 0 4 >
ffff890d2c1f6d80 3230416388 C Bi:1:006:2 0 2 = 1410
ffff890d2c1f6d80 3230416407 S Bi:1:006:2 -115 32 <
ffff890e7cffd3c0 3230416462 S Bo:1:006:2 -115 5 = 74008046 20
ffff890e7cffd3c0 3230416596 C Bo:1:006:2 0 5 >
ffff890e2aadc480 3230419886 C Bi:1:006:2 0 32 = 14821741 f0e0913e 01f0e0eb 5dfe4f95 8f80933e 01ff91ef 919f918f 912f910f
ffff890e2aadc480 3230419905 S Bi:1:006:2 -115 32 <
ffff890d2c1f6d80 3230422473 C Bi:1:006:2 0 32 = 900fbe0f 901f9018 958081f4 cf789484 b5826084 bd84b581 6084bd85 b5826085
ffff890d2c1f6d80 3230422493 S Bi:1:006:2 -115 32 <
ffff890e2aadc480 3230425264 C Bi:1:006:2 0 32 = bd85b581 6085bd80 916e0081 6080936e 00109281 00809181 00826080 93810080
ffff890e2aadc480 3230425284 S Bi:1:006:2 -115 32 <
ffff890d2c1f6d80 3230428012 C Bi:1:006:2 0 32 = 91810081 60809381 00809180 00816080 93800080 91b10084 608093b1 008091b0
ffff890d2c1f6d80 3230428030 S Bi:1:006:2 -115 32 <
ffff890e2aadc480 3230430136 C Bi:1:006:2 0 2 = 0010
ffff890e2aadc480 3230430154 S Bi:1:006:2 -115 32 <
ffff890e7cffd3c0 3230430208 S Bo:1:006:2 -115 4 = 55800320
ffff890e7cffd3c0 3230430369 C Bo:1:006:2 0 4 >
ffff890d2c1f6d80 3230432889 C Bi:1:006:2 0 2 = 1410
ffff890d2c1f6d80 3230432907 S Bi:1:006:2 -115 32 <
ffff890e7cffd3c0 3230432967 S Bo:1:006:2 -115 5 = 74008046 20
ffff890e7cffd3c0 3230433098 C Bo:1:006:2 0 5 >
ffff890e2aadc480 3230436390 C Bi:1:006:2 0 32 = 14816080 93b00080 917a0084 6080937a 0080917a 00826080 937a0080 917a0081
ffff890e2aadc480 3230436409 S Bi:1:006:2 -115 32 <
ffff890d2c1f6d80 3230439011 C Bi:1:006:2 0 32 = 6080937a 0080917a 00806880 937a0010 92c100e0 913501f0 91360182 e08083e0
ffff890d2c1f6d80 3230439029 S Bi:1:006:2 -115 32 <
ffff890e2aadc480 3230441764 C Bi:1:006:2 0 32 = 913101f0 91320110 82e09133 01f09134 018fec80 8310923d 01e09139 01f0913a
ffff890e2aadc480 3230441782 S Bi:1:006:2 -115 32 <
ffff890d2c1f6d80 3230444519 C Bi:1:006:2 0 32 = 0186e080 83e09137 01f09138 01808180 618083e0 913701f0 91380180 81886080
ffff890d2c1f6d80 3230444538 S Bi:1:006:2 -115 32 <
ffff890e2aadc480 3230446512 C Bi:1:006:2 0 2 = 8310
ffff890e2aadc480 3230446532 S Bi:1:006:2 -115 32 <
ffff890e7cffd3c0 3230446587 S Bo:1:006:2 -115 4 = 55c00320
ffff890e7cffd3c0 3230446727 C Bo:1:006:2 0 4 >
ffff890d2c1f6d80 3230449262 C Bi:1:006:2 0 2 = 1410
ffff890d2c1f6d80 3230449282 S Bi:1:006:2 -115 32 <
ffff890e7cffd3c0 3230449355 S Bo:1:006:2 -115 5 = 74008046 20
ffff890e7cffd3c0 3230449471 C Bo:1:006:2 0 5 >
ffff890e2aadc480 3230452764 C Bi:1:006:2 0 32 = 14e09137 01f09138 01808180 688083e0 913701f0 91380180 818f7d80 83ede9f0
ffff890e2aadc480 3230452782 S Bi:1:006:2 -115 32 <
ffff890d2c1f6d80 3230455510 C Bi:1:006:2 0 32 = e02491e9 e8f0e084 91882399 f090e088 0f991ffc 01e859ff 4fa591b4 91fc01ee
ffff890d2c1f6d80 3230455529 S Bi:1:006:2 -115 32 <
ffff890e2aadc480 3230458138 C Bi:1:006:2 0 32 = 58ff4f85 9194918f b7f894ec 91e22bec 938fbfc8 eed3e000 e010e0ee 24e394f1
ffff890e2aadc480 3230458158 S Bi:1:006:2 -115 32 <
ffff890d2c1f6d80 3230460892 C Bi:1:006:2 0 32 = 2c81e090 e00e94aa 0284e191 e00e9438 0261e08d e00e9487 00809100 01909101
ffff890d2c1f6d80 3230460911 S Bi:1:006:2 -115 32 <
ffff890e2aadc480 3230462887 C Bi:1:006:2 0 2 = 0110
ffff890e2aadc480 3230462905 S Bi:1:006:2 -115 32 <
ffff890e7cffd3c0 3230462959 S Bo:1:006:2 -115 4 = 55000420
ffff890e7cffd3c0 3230463093 C Bo:1:006:2 0 4 >
ffff890d2c1f6d80 3230465639 C Bi:1:006:2 0 2 = 1410
ffff890d2c1f6d80 3230465657 S Bi:1:006:2 -115 32 <
ffff890e7cffd3c0 3230465712 S Bo:1:006:2 -115 5 = 74008046 20
ffff890e7cffd3c0 3230465838 C Bo:1:006:2 0 5 >
ffff890e2aadc480 3230469149 C Bi:1:006:2 0 32 = 148c9fb0 018d9f70 0d9c9f70 0d112407 2e000c88 0b990b0e 94f80090 e080e00e
ffff890e2aadc480 3230469184 S Bi:1:006:2 -115 32 <
ffff890d2c1f6d80 3230471775 C Bi:1:006:2 0 32 = 94aa0284 e191e00e 94380260 e08de00e 94870068 ee73e080 e090e00e 94f80085
ffff890d2c1f6d80 3230471799 S Bi:1:006:2 -115 32 <
ffff890e2aadc480 3230474572 C Bi:1:006:2 0 32 = e291e00e 94890118 16190624 f585e291 e00e9467 01909301 01809300 01bc0199
ffff890e2aadc480 3230474606 S Bi:1:006:2 -115 32 <
ffff890d2c1f6d80 3230477240 C Bi:1:006:2 0 32 = 0f880b99 0b97ff12 c00e9489 0286e191 e00e9438 02809100 01909101 01181619
ffff890d2c1f6d80 3230477276 S Bi:1:006:2 -115 32 <
ffff890e2aadc480 3230479313 C Bi:1:006:2 0 2 = 0610
ffff890e2aadc480 3230479350 S Bi:1:006:2 -115 32 <
ffff890e7cffd3c0 3230479517 S Bo:1:006:2 -115 4 = 55400420
ffff890e7cffd3c0 3230479778 C Bo:1:006:2 0 4 >
ffff890d2c1f6d80 3230482052 C Bi:1:006:2 0 2 = 1410
ffff890d2c1f6d80 3230482071 S Bi:1:006:2 -115 32 <
ffff890e7cffd3c0 3230482198 S Bo:1:006:2 -115 5 = 74008046 20
ffff890e7cffd3c0 3230482380 C Bo:1:006:2 0 5 >
ffff890e2aadc480 3230485694 C Bi:1:006:2 0 32 = 14f4f2f0 920101e0 920001d9 cf4ae00e 944502ec cf80911a 0190911b 019c012f
ffff890e2aadc480 3230485728 S Bi:1:006:2 -115 32 <
ffff890d2c1f6d80 3230488484 C Bi:1:006:2 0 32 = 5f3f4f30 931b0120 931a010e 94aa0288 e191e00e 94380201 15110509 f491cf0e
ffff890d2c1f6d80 3230488519 S Bi:1:006:2 -115 32 <
ffff890e2aadc480 3230491102 C Bi:1:006:2 0 32 = 94950188 2309f48c cf0e9400 0089cfe5 e2f1e013 82128288 ee93e0a0 e0b0e084
ffff890e2aadc480 3230491139 S Bi:1:006:2 -115 32 <
ffff890d2c1f6d80 3230493738 C Bi:1:006:2 0 32 = 839583a6 83b78386 e091e091 83808385 ec90e095 87848784 ec90e097 87868780
ffff890d2c1f6d80 3230493759 S Bi:1:006:2 -115 32 <
ffff890e2aadc480 3230495649 C Bi:1:006:2 0 2 = ec10
ffff890e2aadc480 3230495675 S Bi:1:006:2 -115 32 <
ffff890e7cffd3c0 3230495833 S Bo:1:006:2 -115 4 = 55800420
ffff890e7cffd3c0 3230495983 C Bo:1:006:2 0 4 >
ffff890d2c1f6d80 3230498479 C Bi:1:006:2 0 2 = 1410
ffff890d2c1f6d80 3230498514 S Bi:1:006:2 -115 32 <
ffff890e7cffd3c0 3230498681 S Bo:1:006:2 -115 5 = 74008046 20
ffff890e7cffd3c0 3230498894 C Bo:1:006:2 0 5 >
ffff890e2aadc480 3230502231 C Bi:1:006:2 0 32 = 1490e091 8b808b81 ec90e093 8b828b82 ec90e095 8b848b86 ec90e097 8b868b11
ffff890e2aadc480 3230502268 S Bi:1:006:2 -115 32 <
ffff890d2c1f6d80 3230504781 C Bi:1:006:2 0 32 = 8e128e13 8e148e08 95a1e21a 2eaa1bbb 1bfd010d c0aa1fbb 1fee1fff 1fa217b3
ffff890d2c1f6d80 3230504801 S Bi:1:006:2 -115 32 <
ffff890e2aadc480 3230507602 C Bi:1:006:2 0 32 = 07e407f5 0720f0a2 1bb30be4 0bf50b66 1f771f88 1f991f1a 9469f760 95709580
ffff890e2aadc480 3230507634 S Bi:1:006:2 -115 32 <
ffff890d2c1f6d80 3230510288 C Bi:1:006:2 0 32 = 9590959b 01ac01bd 01cf0108 95ee0fff 1f0590f4 91e02d09 94f894ff cf010000
ffff890d2c1f6d80 3230510324 S Bi:1:006:2 -115 32 <
ffff890e2aadc480 3230512399 C Bi:1:006:2 0 2 = 0010
ffff890e2aadc480 3230512421 S Bi:1:006:2 -115 32 <
ffff890e7cffd3c0 3230512554 S Bo:1:006:2 -115 4 = 55c00420
ffff890e7cffd3c0 3230512718 C Bo:1:006:2 0 4 >
ffff890d2c1f6d80 3230515193 C Bi:1:006:2 0 2 = 1410
ffff890d2c1f6d80 3230515228 S Bi:1:006:2 -115 32 <
ffff890e7cffd3c0 3230515390 S Bo:1:006:2 -115 5 = 74008046 20
ffff890e7cffd3c0 3230515646 C Bo:1:006:2 0 5 >
ffff890e2aadc480 3230518856 C Bi:1:006:2 0 32 = 140000cb 012b0158 01180289 0167017b 01610062 006300ff ffffffff ffffffff
ffff890e2aadc480 3230518892 S Bi:1:006:2 -115 32 <
ffff890d2c1f6d80 3230521520 C Bi:1:006:2 0 32 = ffffffff ffffffff ffffffff ffffffff ffffffff ffffffff ffffffff ffffffff
ffff890d2c1f6d80 3230521541 S Bi:1:006:2 -115 32 <
ffff890e2aadc480 3230524318 C Bi:1:006:2 0 32 = ffffffff ffffffff ffffffff ffffffff ffffffff ffffffff ffffffff ffffffff
ffff890e2aadc480 3230524356 S Bi:1:006:2 -115 32 <
ffff890d2c1f6d80 3230526905 C Bi:1:006:2 0 32 = ffffffff ffffffff ffffffff ffffffff ffffffff ffffffff ffffffff ffffffff
ffff890d2c1f6d80 3230526985 S Bi:1:006:2 -115 32 <
ffff890e2aadc480 3230529196 C Bi:1:006:2 0 2 = ff10
ffff890e2aadc480 3230529232 S Bi:1:006:2 -115 32 <
ffff890e7cffd3c0 3230529602 S Bo:1:006:2 -115 2 = 5120
ffff890e7cffd3c0 3230529721 C Bo:1:006:2 0 2 >
ffff890d2c1f6d80 3230532152 C Bi:1:006:2 0 2 = 1410
ffff890d2c1f6d80 3230532187 S Bi:1:006:2 -115 32 <
ffff890d2c1f6600 3230532339 S Co:1:006:0 s 40 a4 ffff 0000 0000 0
ffff890d2c1f6600 3230532664 C Co:1:006:0 0 0
ffff890d2c1f6600 3230532761 S Co:1:006:0 s 40 9a 1312 b282 0000 0
ffff890d2c1f6600 3230533018 C Co:1:006:0 0 0
ffff890d2c1f6600 3230533095 S Co:1:006:0 s 40 9a 2518 00c3 0000 0
ffff890d2c1f6600 3230533410 C Co:1:006:0 0 0
ffff890d2c1f6600 3230533488 S Co:1:006:0 s 40 a4 ffff 0000 0000 0
ffff890d2c1f6600 3230533800 C Co:1:006:0 0 0
ffff890d2c1f6600 3230533913 S Co:1:006:0 s 40 a4 ffff 0000 0000 0
ffff890d2c1f6600 3230534092 C Co:1:006:0 0 0
ffff890e2aadc480 3230537702 C Bi:1:006:2 -2 0
ffff890def160d80 3230537757 S Co:1:002:0 s 23 08 9062 0001 0000 0
ffff890d2c1f6d80 3230537826 C Bi:1:006:2 -2 0
ffff890def160d80 3230538015 C Co:1:002:0 0 0
ffff890ecbe43180 3230540035 C Ii:1:006:1 -2:1 0
